Index	Tweet
0	graças a deus eu paro de tomar esse veneno que é o azitromicina já não aguento trabalhar com essa dor de estômago .
1	o bom da azitromicina é que além de ser bom pra doença é maravilhoso pra pele e faz efeito bem rápido .
2	pérolas da dra p azitromicina foi muito usada pra dor de piolho oi .
3	só qiem sofre mensalmente de inchaço nas amidalas sabe o poder de uma azitromicina e como é importante ter umas 2 caixas em casa sempre kkkk .
4	tomar azitromicina é o msm que dar um tiro no estômago pqp q dor do crlh .
5	eu saio da ansiedade mais a ansiedade gosta de bromazepam .
6	indo dormir com dor de cabeça pra variar vivendo nesse hospício só com uma dose de bromazepam p acalmar .
7	tomava o paroxetina pra ansiedade e depressão bromazepam era pra insônia e sintomas depressivos .
8	bromoprida o médico disse q seria preciso contra enjôo e náuseas assim seguimos acompanhando à sessão .
9	bromoprida para mal estar e neosaldina pra dor ce cabeça mas sua dor de cabeça deve ser consequência do mal estar .
10	recklessbutfab é só bromoprida eu fiquei com tontura e dor de cabeça enquanto dormia e aí sonhei louco .
11	você faz tratamento pra ansiedade e depressão toma sim venlafaxina 375 mg e bupropiona 150 mg http curiouscat me nightsofwonders post 30297274 .
12	a gente volta p tt quando n tem mais opção do que fazer e a essa hora da madrugada e com tanta cafeína na cabeça a agitação vem a tona .
13	acordei de ressaca e sono fui pra aula tomei remédio pra dor de cabeça que tem cafeína chego em casa doida pra dormir mas não consigo .
14	cafeína é maravilhoso pra dor de cabeça ou toma um chá preto analgésico energético slá .
15	cafeína melhora dor de cabeça tem até um tylenol só pra dor de cabeça que é com cafeína .
16	cafeína não é legal pra ansiedade .
17	é pq eu tenho muito desses tremores causados pela ansiedade sabe aí a cafeína piora mais ainda junto com os outros sintomas .
18	eu louca querendo dormir por causa da dor e minha mãe me dá um remédio que tira a dor mas contém cafeína q tira o sono .
19	eu tava com dor de cabeça tomei remédio tem cafeína agora que não durmo mesmo .
20	eu to paralisada de dor e todo remédio pra dor de cabeça tem cafeína por isso não entendi .
21	eu tomei relaxante muscular e intiinflamatorio pra dor nas costas e 2 pílulas de cafeína eu estou morrendo de sono .
22	gente acabei de ler aqui que cafeína não faz bem no calor pelo mal que tô passando a informação procede staysafe belohorizonte60graus .
23	houve alguma coisa dongsaeng eu tô bem só com dor de cabeça por falta de cafeína .
24	i cant believveeee tomei um remédio pra dor de cabeça e esqueci que tem cafeína nele agkra que eu só consigo dormir amanhã mesmo .
25	legar que exagero de cafeína pode te fuder com dor de cabeça enjoou insonia e como ela mexe com os batimentos cardíacos pode dar ritmia .
26	minha dores de cabeças são sempre tensionais por causa da minha ansiedade mas sinto que a cafeína fez aumentar .
27	muita cafeína pra aguentar esses dias com o calor não durmo direito e no trabalho caio no sono .
28	n tomei café hj ainda to morrendo de dor de cabeça preciso de cafeína socorro .
29	não posso dormir demais pq da aquela dor de cabeça de abstinência de cafeína .
30	não queria tomar café agora mas eu infelizmente estou com uma dor de cabeça que grita cafeína que que eu faço .
31	não sei quem culpar pela enxaqueca de hoje o cabelo a vista ou a falta da cafeína .
32	nesse calor é impossível não suar imagina com 420g de cafeína no sangue kkk .
33	nossa eu tive q fazer café pq tava com dor cabeça pela falta de cafeína .
34	o foda de eu tomar meu remédio de dor de cabeça é que é cafeína pura e me deixa sem nenhum sono .
35	o foda é eu estar com dor de cabeça e não poder tomar remédio porque o remédio tem cafeína e eu tenho labirintite .
36	o q será q acontece se eu tomar remédio p dor de cabeça c cafeína e calmante .
37	quase todos os remédios p dor de cabeça têm cafeína eu amo cafeína mas não num remédio que supostamente era pra te deixar calma e sem dor .
38	quatro dias sem cafeína e quatro dias chorando com uma enxaqueca the moniaca serasse que estou viciada .
39	quer dizer toma cafeína é bom pra dor .
40	queria matcha café quente nesse calor não dá e gelado perde cafeína né .
41	se não fosse a cafeína eu estaria em coma agora .
42	tá osso trabalhar com esse calor cadê as pílulas de cafeína quand a gente precisa delas .
43	tinha planos de entrar em coma hoje mas se eu dormir agora acordo umas 4h da manhã parecendo que tomei cafeína na veia .
44	to tomando remédio pra dor muscular e apesar de ter cafeína me deixou o dia todo com sono .
45	tomei uns dois remédios pra dor antes agora tomei um pra enxaqueca que contém cafeína quero ver se nao passa essa dor .
46	vest me trouxe coisas incriveis como insônia vicio em cafeína enxaqueca .
47	viciados em cafeína sofrem no calor .
48	vício de cafeína é fogo passei a manhã com dor de cabeça e só agora me toquei que não tomei um gole de café ainda .
49	amora é rico em cálcio amor é rico em calor https www instagram com p 18q9dtko pic twitter com k6zw84nsfy .
50	desde q sou pequena minha mãe reclama d uma dor na perna e todos os médicos sempre falavam q era falta de cálcio .
51	eu sofro de toc depressão anemia problemas respiratórios falta de vitaminas falta de cálcio íos problema nos ovários e vcs .
52	não poxa que pena bom pra dor assim é omeprazol a. não precisa de beber litros de leite para ir buscar o cálcio de que necessita coma mais legumes de folha verde http fb me 4hhkpyf0x .
53	tomei captopril achando que era pra dor mais er pra pressão agr to começando ver tudo roda mane .
54	vou tomar meu captopril para não enfartar de tanta raiva hoje jogam de titulares wellington cesar e leandrinho .
55	levanta a mão quem tomou 10 comprimidos de tramal 4 de dipirona 2 de lyrica 1 carbamazepina e ainda está com dor o. levantei rápido e com a dor intensa deu vertigem acho que foi isso ou pode ser por conta da baixa de glicose tbm sei lá .
56	eu deveria tomar o remédio pra dor só de manhã mas como n to conseguindo dormir vou tomar agr mesmo q dormir chapada de carisoprodol .
57	eu to deitada queimando de febre mt dor na garganta se alguém tiver amoxilina ou cefalexina pfvr falem cmg .
58	minha mãe comprou cefalexina p eu tomar só de olhar p caixa me dá dor de estômago .
59	quase morri de tanta febre sequei um frasco de dipirona duas cartelas de cefalexina e minha mãe ainda queria q eu fosse p hospital sozinha .
60	e pra quando vc tiver com a alergia muito arregaçada vc pode tomar beclometasona ou fluticasona betametasona dexametasona .
61	ah é bom saber quando tomei dipirona eu fiquei em coma só .
62	ai fudeu ai eu vou ficar poha suavekkkkkkkkkkk haja dipirona pra essas dor de cabeça jesus .
63	além de sofrer pela cólica tenho q sofrer tomando dipirona líquid .
64	aquela dipirona pra acabar com a cólica bem lets go .
65	dipirona é mais pra cólica dor de cabeça .
66	dipirona sódica pra cefaleia e vodka pro espirito ia29 .
67	e eu vou sextar com mt dor de cabeça deitada na minha cama tomando dipirona mas querendo um neosaldina https twitter com lordevoidemort status 814891448910876672 .
68	ela tava doente dipirona entrou na mente dor de cebeça bebe .
69	esqueço que tenho alergia a dipirona tomei remédio pra dor ontem e agora meus olhos estão inchados .
70	estou morrendo de dor d cabeça mas não posso toma dipirona pq tenho alergia e aq em casa não tem nenhum outro comprimido p dor .
71	eu estava com um cólica tão insuportável que eu tomei 4 comprimidos de dipirona e 1 colher de dipirona líquida dormi que é uma beleza .
72	eu ja to morrendo de alergia ai eu tomei um remedio pra parar alergia q tem dipirona na qual tenho alergia poise .
73	eu não consigo dormir com a dor no dente tomei dipirona apareceu uma cólica .
74	eu sempre fico em dúvida entre morrer de dor e tomar dipirona .
75	fingi que tava com dor de cabeça pra não sair de casa meu pai me obrigou tomar dipirona .
76	fui no shopping hoje voltei morrendo de cólica e tive que tomar dipirona mpn felipecastanhari .
77	graças a deus dipirona fazendo milagres nessa febre agr é tomar esse banho pois fedendo a doente e esperar mae chegar com meu benegripe .
78	já tomei três comprimidos pra cólica e nada agora vou tomar 70 gotas de dipirona e vou dormir até amanhã kkkk se http fb me 573bmxk9m .
79	jeff pense quantos wolfies entrarão em depressão e cometerão suicídio tomando 50 compridos de dipirona reflita teenwolfseason7please .
80	legal msm é não conseguir dormir pq tá com cólica e por falta de remédio tomar dipirona pra ver se passa dor infernal .
81	mano tomei um remédio pra febre pensando que era paracetamol porém minha alergia a dipirona está atacando olhos estão enviando .
82	nada tô c a garganta inflamada e febre p piorar tenho alergia a dipirona .
83	não tem remédio pra cólica tive que tomar dipirona e dramin pq dipirona da uns negócio no estômago .
84	não to sabendo lidar cm esse calor ainda tomei dipirona to suando igual uma mula .
85	nem dipirona tá fazendo efeito pra essa cólica do inferno .
86	passei o dia todo com essa cólica tive que toma duas dipirona agora .
87	pqp to queimando em febre e não sei cadê a caralha da dipirona .
88	qual o analgésico que ri da sua dor e desgraça r dipirona sádica 500 mg diadofarmacêutico via diego gresso .
89	quando você reclama de dor de cabeça e a pessoa vem com tem dipirona aqui em casa tá mas e aí vai vir trazer pra mim .
90	quem toma dipirona quando ta morrendo de cólica eu claro kakakaka vai adiantar nada .
91	será que dipirona também é pra cólica num aguento maaaaaas .
92	sou igual dipirona ou vc me engole ou ficar com dor .
93	tomar dipirona ou ficar com dor eis a dúvida .
94	tomei 3 paracetamol e dipirona que me deixou em coma até agora kk .
95	tomei 50 gotas de dipirona p essa merda de cólica passar e agr to morrendo de sono e não posso dormir .
96	tomei dipirona e agora estou ficando com calor .
97	tomei do dipirona daqui a pouco começo a passar mal de tanto calor .
98	tomei uma dipirona não tô aguento de tanta cólica .
99	vai passar sim passei 2 meses sofrendo de dor dente por causa do meu siso dipirona vai aliviar sua dor .
100	2 5 km de caminhada hoje como estamos com menos raiva bendita dopamina .
101	amarelito já pensou em tomar dopamina pra controlar um pouco a depressão https twitter com amarelito status 721027427909152768 .
102	dopamina sendo liberada pela dor do treino .
103	fui correr não só liberei dopamina serotonina como liberei suor mt suor .
104	meu cérebro ta com dependência de dopamina vamo trabalhar isso aí .
105	não tô acreditando em toda essa confusão por causa de um trocadilho com dopamina to rindo demais .
106	pra quem tava esses dias com o cérebro nadando em dopamina e com ansiedade logo insônia é assustador mesmo .
107	tava tentando passar um dia todo sem tomar café e sem reclamar da mãe tomando efedrina e ficar reclamando de dor mas não tenho mais forças .
108	essa epinefrina tá me deixando numa raiva mas fico mais ativo plmns .
109	queria fazer nada amanhã só morrer com minha cólica e meu butilbrometo de escopolamina .
110	deus já sabe o frio que tô passando por causa da febre e do meu desejo de passar ferro quente na cara de vcs parem de me mandar foto do sul .
111	aime garotona de 2 anos e 8 meses dependente de fluoxetina desde os 6 meses de idade por sofrer de ansiedade http fb me 2ebadix2y .
112	chapar de sibutramina e fluoxetina p entrar em coma seria uma boa .
113	é fluoxetina 1 comprido ao dia pra ansiedade .
114	e pra ansiedade fluoxetina não tá mais me ajudando e eu tomo doses cavalares dele .
115	estou a entrar em depressão por causa de farmacologia preciso de fluoxetina .
116	eu não tenho fluoxetina o bastante pra lidar com essa ansiedade de esperar coisa por correio .
117	eu tono fluoxetina não pra dormir pra ansiedade mas me ajuda a dormir .
118	fluoxetina é lindo pra isso kkkkk tomei durante um tempo pela ansiedade .
119	fluoxetina é muito usado para depressão síndrome do pânico na verdade é o prozac .
120	fluoxetina é só pra ansiedade não dá sono lexotan da sono mas passa no médico antes .
121	fluoxetina emagrece pq deve sair td q tu come pelo suor satã me ajuda .
122	fluoxetina n funciona porra nenhuma só te deixa com mais dor .
123	fluoxetina usada em remédios p emagrecer alguns anti depressivos a maioria dos remédios para ansiedade https twitter com eudanborges status 759492732582756353 .
124	já que eu falei sobre depressão esta música às vezes funciona melhor do que fluoxetina https youtu be d8z vn67sru http fb me 7udn9qbut .
125	lucksnake aee eu tomo oxalato pra ansiedade quando ataca forte e nitrazepam pra quando n consigo dormir fazer o q né fluoxetina larguei .
126	marciasensitiva me ajude minha filha usa fluoxetina tem pânico toc ansiedade samara pereira silva 29 02 2004 prematura 6mês oq posso fazer .
127	menina eu sou a loka q come sem fome apenas por ansiedade ando tomando fluoxetina consegui a receita indo no médico .
128	minha mae ta morrendo de medo de eu entrar em depressão mas nao deixa eu continuar tomando fluoxetina .
129	minha mãe toma diazepam pra ansiedade minha vó toma fluoxetina pra depressão e ate tem o meu cachorro que é nervoso e toma gardenal .
130	o garçom no final de rodízio entra em depressão pensa no suicídio vai na cozinha tomar fluoxetina .
131	o massa de estar com dor no estômago é que eu não posso de jeito nenhum tomar fluoxetina hoje que sacoooooooooououou .
132	saudades de quando eu tinha bads antes da depressão e o fluoxetina entrar na minha vida .
133	só quem sofre de ansiedade sabe o quanto aquela sensação de borboletas no estomago é a pior coisa do mundo não tem fluoxetina que ajude .
134	tbm tenho esse fator porém pela depressão eu tomo fluoxetina durante o dia e clonazepan pra dormir n sempre só nas crise msm .
135	thaygarbone amg eu tomo por conta de ansiedade aí tem receita médica mas rivotril e fluoxetina são bons .
136	tomando remédio por causa do pânico e impressionada com a mágica q é essa fluoxetina até a cólica e a tpm diminuiu .
137	vou tomar umas fluoxetina porque tô entrando em depressão aqui .
138	100or glicose 289 pqp deve ser por isso o edema nos pés e tonturas constantes .
139	11 5 20 24 marcely vai todo mundo entrar em coma a alcoólico sexta haha 11 5 20 25 marcely aqui não tem glicose nao alguem me segura .
140	23 anos término da faculdade sofrendo de ansiedade e com a pressão e a glicose alta prazer rodrigo pereira .
141	583 eu sinto tontura quando estou com sono pressão baixa glicose baixa ou glicose alta .
142	a produção dr glicose leva à morte geraldo 2016 .
143	a zoe faz muita glicose anal já to ficando com raiva já .
144	achei q no domingo iria entrar em coma alcoolico mas babou só de raiva amanhã vou me dopar de glicose .
145	acho que tem a ver com o negócio que minha glicose abaixa muito fico com dor de cabeça e muito sono .
146	aeliminacao já deram glicose pra ela ela tá em coma alcoolico .
147	amanhã só paro de beber depois que entrar em coma alcoolico e tiver que tomar glicose na veia .
148	ando bebendo muito suco nesse calor porém voltarei para a aguinha básica porque minha glicose tá alta frutose me derrubando diabetes .
149	bebi tantas coisas hj e acho q tem vodka aqui se eu bao vomitar tem grande chance de eu yomar glicose ou eu entrar em coma alccolico .
150	cara sábado minha meta é entrar em coma alcoólico ou tomar mt glicose na veia .
151	chegar em casa e encontrar mamãe com febre dor no corpo glicose alta corta meu coração em um nível que meu deus .
152	coca cola tem gosto de morte com superdosagem de glicose e xarope .
153	começo do mês que vem eu vou numa dessas lojas de doce comprar bastante glicose pra botar no sangue e não entrar em coma alcoólico .
154	comi tanto chocolate q vou entrar em coma de glicose .
155	crazyandweak é miga é da festa pro coma os famigerado 40 min de glicose ne non .
156	da uma raiva de conversar com as pessoas e elas vem com glicose anal e drama vai procurar um psicólogo e depois fala comigo .
157	deveria estar dormindo mas eu estou com sono e eufórico ao mesmo tempo uma leve crise de ansiedade que fez minha glicose subir .
158	drawmuky caioscholze ninguém em coma em qqqq leva a glicose junto cgiyoftidcupgc .
159	edsonjr2301 fui parar no hospital e a enfermeira aplicou glicose na veia pensando q eu tava em coma alcolico .
160	em busca de métodos de colocar a maior quantidade possível de glicose no sangue tenta sobrevive a uma cólica sem remédio aqui em casa tá ó .
161	esse ano bebi algumas 10 vezes por motivos de glicose fácil no rolê ou calor infernal foi um ano intenso e velho a vontade voltou absurdo .
162	estão me entupindo de glicose agorinha entro em coma diabético .
163	estou às vésperas de fazer o maldito exame de glicose estou com raiva .
164	eu costumo ficar com dor de cabeça mas até que sai do cinema deboas acho que tava bem alimentado e cheio de glicose no corpo .
165	ficar estudando sobre a glicose galactose já da dor de barriga .
166	glicose alta morrendo de dor de cabeça .
167	glicose da minha mãe é muito 8 ou 80 tncc uma hora quase ela entra em coma outra quase dando hipoglicemia .
168	glicose e pressão alta pelo menos não é o coração a dor no peito ufa .
169	hj eu vo mete o famigerado só volto pra casa em coma tomando glicose na veia se a deusa quiser .
170	liguei pra minha mãe pra falar que tava morrendo de tontura e agora a linda quer medir minha glicose .
171	mano n entendo isso quando eu vejo me da arrepios e a glicose aumenta credo https twitter com picscomida status 759830340986871808 .
172	meu colega entro em coma alcoólico teve q toma 3 injeções d glicose o coração dele tava quase parando e chego n sala dizendo eu sou foda .
173	michgiglio nossa sim por favor quero morrer de coma de glicose cobrarei apenas me espere .
174	minha glicose deve estar na morte .
175	minha glicose fica abaixando com esse calor e eu fico passando mal toda hr .
176	minha glicose já caiu quase desmaiei tô morrendo de dor de cabeça td por causa desse show .
177	na real me lembra um remédio pra febre que eu detestava ou algo que tem textura de lama e sabor de xarope de glicose .
178	nesse calor um açaí é super bem vindo né e se for sem xarope de glicose melhor ainda é super fácil de fazer http fb me 4oynfwidm .
179	nossa eu fui ali só pra pegar um exame de glicose e to morrendo de calor pqp .
180	notjorge eu tava em coma por causa da cantina quando acordei ele tava tentando enfiar uma agulha em mim pq ele ia injetar glicose .
181	nunca vou esquecer daquele quase morte quando eu fui fazer exame de sangue e minha glicose deu muito alterada .
182	o diabetes é uma doença crônica que se caracteriza por hiperglicemia glicose elevada no sangue causada pela http fb me 5x1a4ajvv .
183	o povo entra em coma alcoólico e acha que um chocolatezinho resolve que ir pra glicose endovenosa tá tudo certo .
184	ontem voltei do jogo explodindo de dor de cabeça disseram q tomar água com uma colher de glicose pura resolve mas onde encontro p comprar .
185	pelo menos nunca paguei esse micao de entra em coma alcoolico e ter q toma glicose na veia amém .
186	por mais que eu coma só salada cheik não jante faço hidro e pilates não emagreco 1 grama mas minha glicose está normal era o q queria .
187	pra que namoradinho se tenho mainha e painho p chegar c alto teor de glicose pra acabar c minha cólica .
188	preciso dormir tomei uma caixa de leite condensado minha glicose ta mt alta agora to hiperativa e com raiva e isso não é bom .
189	prova de amor entra em coma alcoolico que eu entro junto com vc unidos na glicose .
190	quase entrei em coma agora há pouco por causa da hipoglicemia minha glicose foi a 40 .
191	quase morri de dor pra fazer o teste de glicose .
192	queria comer chocolate até a morte maaas tenho que controlar minha glicose pra doar sangue amanhã .
193	queria tomar todas cachaças a ponto de entrar em coma alcoólico e tomar glicose no hospital .
194	railane f a essa altura estouno hospital em coma tomando glicose .
195	seria tipo gnt eu com falar da doença do glicose que o mosquito que rasteja meu nome é pro trabalho de artes da https twitter com imgmagcon status 704827135370928129 .
196	tava morrendo de fome e fraqueza e fiz uma bomba maravilhosa de glicose comer um sonho de valsa seguido de um laka desses pequenininhos 3 .
197	tipo entrar em coma alcóolico ir parar no hospital pra tomar glicose ou algo do tipo .
198	tomar injeção de glicose entrar em coma alcoólico várias piras .
199	tomo glicose até não querer mais e medicamento pra dor na veia rapidinho melhoraaaaaa .
200	uiahiauhaiuha pelo que eu vi tem a ver com alergia calor ou glicose qualquer uma poide se aplicar no meu caso .
201	um dia depois de tomar uma seringa imensa de buscopan glicose na veia eu sigo normalmente com minha dor .
202	um salve so para a rapaziada q ja tomou glicose na veia e quase entrou em coma alcoolico kkk .
203	vc tá sem nada no estômago se entope de alimento com glicose e depois morre de tontura adoro ter uns problema mesmo .
204	venlafaxina x haloperidol http www interacaomedicamentosa com 2016 02 venlafaxina x haloperidol html spref tw farmacia saude farmacoterapia depressao ansiedade serotonina .
205	daniloarock cloridrato de hidroxizina é pra alergia mas da um efeito de sedativo menino parado louquíssima .
206	0 5 é a dosagem mínima se você não tem alergia a ibuprofeno amanhã você vai acordar sem dor .
207	a melhor coisa a se fazer quando está com cólica é colocar uma bolsa de gelo tomar ibuprofeno e dormir .
208	a pessoa ta quase chorando de tanta cólica o ibuprofeno não faz efeito faz o que deita no chão da sala da mãe e coloca os pes pra cima .
209	a princesinha aqui esqueceu de comprar ibuprofeno e acordou com cólica 3 am .
210	acabo de passar em farmacologia e resolvo tomar 400 mg de ibuprofeno pra cólica de estômago vazio dois dias depois de ter uma lesão gástrica .
211	aí vc tá morrendo de cólica é o milagre era tomar ibuprofeno mas vc vai em um nefro com seu pai e ele fala q antiflamatorios acabam os rins .
212	alguém me diz se ibuprofeno serve pra dor de cabeça eu to morrendo e só tenho isso .
213	blodornbaby nimesulida ibuprofeno tem gosto de morte .
214	cê acredita que ponstan não faz cócegas na dor só me deixa grogue aqui só ibuprofeno salva .
215	com febre e cólica e vou ter q tomar o ibuprofeno gotas do meu irmão q a dosagem n faz nem cosquinha em mim pq n acho o comprimido .
216	comecei a ficar com dor de cabeça por causa do álcool meti um ibuprofeno nunca me senti tão bem na vida .
217	eu morrendo de dor de estomago e a pessoa me empurra um ibuprofeno quer me matar .
218	eu tava c uma dor insuportável na boca por causa de duas malditas aftas pinguei ibuprofeno e funcionou de vdd jsjsddjdjdjd fiquei boba né .
219	eu tava com dor de cabeça aí não tinha comprimido aí eu tomei um vidrinho daquele de ibuprofeno em gotas será q eu vou morrer .
220	eu tenho o ibuprofeno eu acho ele é de dor etc é bom pra cólica .
221	eu tinha que ser garota propaganda do ibuprofeno cr tomo ibuprofeno pra dor de cabeça cólica febre alergia tudo kkkkkkkk .
222	eu tô morrendo de cólica é minha mãe não quer deixar eu tomar o remédio pq ela viu em algum lugar que ibuprofeno tá fazendo mal .
223	eu tô sozinha em casa e tô morrendo de dor de garganta e de cabeça minha mãe falou pra eu tomar ibuprofeno .
224	faz uma semana que tô com uma dor insuportável no pescoço tá foda vou apelar pro ibuprofeno acho que é assim que se escreve uma pancada .
225	gente não consigo fazer nada com essa dor alguem me dá um ibuprofeno .
226	hoje foi o ibuprofeno que me salvou da dor de cabeça naramig não funcionou .
227	ibuprofeno de 6 6 hrs serve pra dor e é antiinflamatório vai ajudar bastante .
228	ibuprofeno é bom pra cólica .
229	ibuprofeno é pra dor de cabeça .
230	ibuprofeno eu não conhecia estou com a mesma dor de cabeça fudida desde ontem vou tentar combinar os dois obrigada .
231	lá se foram as doses de morfina dolantina pra dor ibuprofeno pra febre e histamina pra coceira pic twitter com dv9oshwzqo .
232	meninas q estão com alergia a remédio e acharam q ibuprofeno n entrava na alergia e se foderam .
233	na farmácia mesmo nem precisa de receita e tem o ibuprofeno 400 mg que é mt bom também pra cólica forte .
234	o anticoncepcional sim o ibuprofeno não porque é remédio pra dor e febre mesmo .
235	o plano era aproveitar a dor de cabeça para dormir mas eu tomei um comprimido de ibuprofeno e estou acordada sem dor .
236	obrigada ibuprofeno por conseguir fazer eu dormir com essa cólica absurda .
237	obrigado zeavy consegues juntar a isso uma aspirina ou algo com ibuprofeno tou aqui com uma dor marada é a velhice a chegar .
238	para dor vc pode ir na farmácia e comprar ibuprofeno tenta pingar próximo do dente que ajuda muito .
239	paracetamol amiga ibuprofeno é mais pra febre e inflamação .
240	pra cólica ibuprofeno era o unico que me ajudava nas minhas .
241	pra completar minhas alegrias tô com enxaqueca e não tem ibuprofeno em casa .
242	pra que eu vou querer a poha de um ibuprofeno não tô com dor de cabeça merda .
243	quando nem o ibuprofeno acaba com a dor é sinal que a coisa tá feia .
244	scr que dó quando eu to com cólica ou qualquer tipo de dor durante esses dias eu tomo ibuprofeno o negócio é mágico .
245	se eu fosse mulher ia tá fudido a maioria dos remédios pra cólica tem base dipirona ibuprofeno e eu sou alérgico .
