Index	Tweet
4250	recupere o vigor testosterona impulso sexual força muscular andropausa fadiga e fraqueza https spacodicas wordpress com 2016 08 19 testosterona impulso sexual forca muscular andropausa fadiga e fraqueza .
4251	redrumlary realmente sertralina é um ótimo medicamento eu quero parar de tomar em breve qdo minha ansiedade estiver mais controlada .
4252	referir alergia penicilina x3 riesgo urticaria crónica urticaria crónica x3 posibilidad referir alergia penicilina http ow ly yr1tz .
4253	regisgalo 13 srcabeca batata rmarketeira daniellbravo só azia em antiácido aqui qual vc tomou regis omeprazol ou ranitidina .
4254	relativamente fácil chega no posto e fala que tem depressão vão te meter fluoxetina na .
4255	relevem estou sentindo um pouco de dor cloridrato de ranitidina não está fazendo efeito .
4256	remédio pra calcio almoço pra ministro e o caraio 50 barras de ouro não muda minha ansiedade pra ver o gabriel logo bielnofaro .
4257	remédio pra depressão tinha que ser maconha e não fluoxetina já viu alguém triste chapado ta td feliz da vida rindo dos poste .
4258	remédio pra dor muscular é tão forte q ele já vem com omeprazol embutido pra não passar mal da barriga .
4259	remédios para a acne e aparelho podem causar cárie a isotretinoína sempre foi muito usada para combater a ac http bit ly 2aixljl .
4260	remédios pra enjoo que não causem interação com a paroxetina onde estão vcs .
4261	remédios pro rim pra diminuir glicose etc etc só por causa dos efeitos colaterais dos remédios da sua doença mental .
4262	renatalocutora sou alergica a penicilina agora dipirona se aparecer mais uma alergia a medicamento ferrou não vou ter o q tomar .
4263	reparei que a fluoxetina tirou meu apetite lado bom pra emagrecer mas o stress e ansiedade continuam do mesmo jeito .
4264	repórter da caracol diz que a situação é mais de morte que de vida forçachape .
4265	repórter da rádio caracol disse que o clima é de morte no local do acidente a situação não é animadora .
4266	repórter da rádio caracol diz que infelizmente a situação não é de vida é mais de morte e reitera a dificuldade da busca forçachape .
4267	respondendo o questionário de bioquímica com mta maturidade pq a metionina é um aa essencial n sei nao qro saber e tenho raiva de qm sabe .
4268	resposta escitalopram é para o meu caso isaacefraim psiquiatra escitalopram http fb me 3umdajjiz .
4269	resposta escitalopram irrita o estomago http fb me 4qin2zs9g .
4270	resposta paroxetina ou fluoxetina http fb me 4rmzstwju .
4271	resposta paroxetina serve para mim isaacefraim psiquiatra paroxetina http fb me 7xzejaoad .
4272	resposta tomei paroxetina e minha pressão baixou isaacefraim psiquiatra ansiedade http fb me kzrcm7u3 .
4273	ressuscitei menino tumblr ow depressão da porra aqueles textos faltava um fumacê de sertralina na vida da menina barrosetal .
4274	resultado da brincadeira 1 omeprazol 1 buscopan 1 advil 1 baita dor de cabeça .
4275	resumão dei pt coma alcoólico cocar ganhou o pr mio glicose na veia não lembro de nada .
4276	resumo da minha vida dor choro e mais dor omeprazol sucos ruins miojo .
4277	retiro o que eu disse sobre meu amor pelo naproxeno sódico pois minha dor nas costas voltou n caiam nessa .
4278	rezende evil os remédios coristina d e nimesulida me fizeram mal alergia tive emorragia interna ai vomitei todo meu sangue do corpo .
4279	rfalcao13 esses vazamentos são patrocinados pela indústria farmacêutica para vender lexotan captopril e imosec para diarréia .
4280	rhigormachado pode beber mais q aposto q ainda bebe pouco toma um dipirona p dor mb .
4281	rhodiola melhor tolerada que a sertralina em casos de depressão https shar es 1zpst0 via sharethis .
4282	rica no aminoácido dopamina controla o humor a fava é indicada para combater os sintomas da depressão http www portaldoholanda com br plantas curam fava e eficiente para manter o humor e combater depressao .
4283	ricas em zinco as sementes de abóbora ajudam a controlar a ansiedade a regular o intestino e fortalecer o http fb me kar0ytbh .
4284	risco financeiro a penicilina não era recomendavel como remedio a questão ética cientifica ou financeira não justificam a morte .
4285	risperidona me dá mt ansiedade depakene eu usei p isso msm só q piorou .
4286	risperidona me deu mt ansiedade e quetiapina é quetros .
4287	roacutan grátis como conseguir peledemenino isotretinoina acne espinhas https youtu be 6zrvcclz3hm via youtube .
4288	robertasalles to tomando sibutramina fico 2 dias sem comer nada e a fome não vem esse remédio eh milagroso mas a dor d cabeça tb uó .
4289	rolê de hoje foi massa bagarai apesar de não poder beber por motivos de tomando amoxicilina e nimesulida pra por um fim à dor de garganta .
4290	rolê dessa madrugada foi ir ao pronto socorro e tomar tramadol na veia a que ponto de dor chegamos .
4291	romulomendonca resumindo após o final de um jogo com drinking game é coma alcoólica e muita glicose tudopelosplayoffsnfl .
4292	rououshiki tinha começado a tratar minha ansiedade com fluoxetina mas tive efeitos colaterais terríveis .
4293	rrafasp vitorialisboa reynolds sooll glicose anal já sabemos qm tem essa doença https twitter com cconfissoes status 786679036525350912 .
4294	rt doença é transmitida pela picada do mosquito aedes aegypti vacina é obrigatória para pessoas que viajarão para áreas endêmicas .
4295	rt vacina contra raiva é uma das exigências para o transporte dos animais viagens internacionais precisam de um certificado especial .
4296	rt vacina de dna é do instituto nacional de alergia e doenças infecciosas esta é a segunda vacina a entrar em testes clínicos no mundo .
4297	rukaasu suor tipo uréia das axilas ou suor tipo águas salgadas saídas dos olhos heteros .
4298	sabadinho preguiçoso mas graças a prednisolona minha alergia que estava muito tensa está https www instagram com p bin4q8qapiz .
4299	sabe aquele desconforto que o orlistate causa com fat redux é totalmente diferente e seguro não promove http fb me 2qe1xn97v .
4300	sabe aqueles caras que entram no bus perfumando com sua testosterona em forma de suor odorizando o bus um sentou na minha frente .
4301	sabe chá de sene dá uma tremenda dor de barriga né .
4302	sabe o que me da mais raiva é a edição bbb vai mostrar a ana paula como uma louca surtada .
4303	sabe que não posso ficar sem omeprazol e faz oq pega a caixa toda e da pro meu tio agora eu fico aqui morrendo de dor .
4304	sabe que pra ir pro egito tem que tomar a vacina pra febre amarela hepatite tetano tifo entre outras .
4305	sabe quem chegou ela mesna a dor da perda .
4306	sabeamaria eu ficava olhando pra galera deitada tomando glicose só pq tava bêbado e eu me contorcendo de dor acho q me curei de raiva .
4307	sabemos que zolpidem mostra três versões minhas a divertida a conselheira e a depressiva com ataque de ansiedade gabstenorio taletinha .
4308	sabia que minha mãe ia falar q minha alergia voltou pq n tomei vacina .
4309	sabiam que a laranja é uma excelente opção contra o cansaço e a fraqueza porque é rica em vitamina c e em açúcar http fb me d3d461sf .
4310	sai da escola vim direto p clínica tomar vacina p alergia .
4311	sai de casa e esqueci de tomar meu pantoprazol logo vou sentir dor pra caralho logo me fodi .
4312	saí do dermatologista aparentemente eu tenho uma alergia rara novidade a qualquer medicamento com ureia .
4313	sai do nimesulida de 100 p biprofenid d 600 passou até as encarnações menos a dor de garganta .
4314	sai nesse calor do caralho pra não ter vacina hoje .
4315	saiba como acabar com as espinhas espinhas acne bicarbonatodesódio dicasdebeleza beleza pele http fb me 5cuiij6n7 .
4316	saiba mais sobre as evidências científicas sobre o uso da amiodarona para prevenir mortes da morte súbita cardíaca http fb me tlyeuuxs .
4317	sailorjinki loratadina é um anti alérgico dos poderosos mas que tb ajuda em crise de doença respiratória e não da sono .
4318	saiu a vacina pra cólica .
4319	salve salve o hidróxido de alumínio esse subway que comi hoje à noite deu uma azia infeliz .
4320	salvia dopamina mas só se vc tiver frita ou chapada acho que bêbada causa uma confusão mental .
4321	santo nimesulida salvando minha dor de garganta .
4322	sarazanella escitalopram ajuda na depressão e ainda te faz dormir o dia todo literalmente .
4323	saudade ainda vai bater no teto até um canalha precisa de afeto dor não cura com penicilina .
4324	saudade de quando dipirona passava a minha cólica .
4325	saudades de quando eu ia no barenco só pra tomar vacina de alergia e quando voltava tomava sorvete .
4326	saudades deste dia corote com tang fifa coma alcoolico 2l de glicose pic twitter com 6zhfsnzsjs .
4327	saudades do calor já ibiuna feriado tiradentes saudades sóquerodormirecomer https www instagram com p be8xjvkxohe .
4328	saudades ir pra enfermaria tomar glicose na veia e quase entrar em coma alcoólico .
4329	saudades tomar vacina da alergia e não precisar ficar coçando o nariz garganta igual uma louca desesperada .
4330	saúde 2 analgésicos como ibuprofeno podem causar depend ncia e piorar a dor tente estas soluções naturais http bispomagalhaes blogspot com 2016 09 saude 2 analgesicos como ibuprofeno html spref tw .
4331	sdds de ficar loka coma aminofilina nem sinto mais nada agr .
4332	sdds fluoxetina q me fazia ter menos ansiedade e menos fome .
4333	sdds não ter cólica e não ser dependente do paracetamol gotas .
4334	sdds tomar vacina de alergia toda semana .
4335	se a pessoa que tem coceira na vacina souber ler como sabe escrever imagino que tipo de vinagre ja passou por ali .
4336	se as pessoas soubessem o efeito da nicotina e do álcool ainda que temporário e o quanto alivia a dor não julgariam tanto .
4337	se bem que a mae tem ainda fluoxetina p ansiedade .
4338	se bem que o ex era cobrador e vivia falando das menininha que sabia o horario dele só pra me fazer raiva nam destá .
4339	se cafeína faz mal sinto que minha morte está próxima .
4340	se criassem em cativeiro sem impacto ambiental e uma morte de propofol não veria motivo contra afinal dor alguma é eterna na alma .
4341	se der febre médico imediatamente senão nimesulida por no máximo uma semana experi ncia própria .
4342	se dor nas costas fosse bom não existia nimesulida precisandodeumantiflamatorio .
4343	se ele tiver apresentando sintoma de dor no estômago omeprazol é bom e um protetor estomacal .
4344	se esse homem ficar com raiva nitroglicerina pura .
4345	se eu fizer uma vitamina agora meu pai vai acordar e vai ficar bem fodido de raiva .
4346	se eu fosse a brighton fingia que a siobhan morreu da mesma forma com a mesma fingiu sua morte e voltava a viver como brighton ringer .
4347	se eu morrer é culpa da mulher do posto de saude que nao quis me aplicar a vacina da febre amarela .
4348	se eu morrer foi porque tomei 100 mg de nimesulida com 40 mg de piroxcan e a dor não diminuiu em nada me salva jesus .
4349	se eu não parar de ouvir dopamine eu vou entrar em estado critico de depressão .
4350	se eu nao tomo minha dose diária de cafeina eu já sinto dor de cabeça .
4351	se eu parar de tomar o remédio de dormir lorazepam eu sinto isso tudo a dor no estômago continua a inflamação na garganta amigdalite .
4352	se eu pegar zika ou qualquer uma dessas virose vo ter q tomar remédio nas aldeias do interior alergia a paracetamol é foda .
4353	se eu pudesse eu queimava minha carteirinha eu te entendo tenho alergia de dipirona sei como é ficar todo empolado .
4354	se eu pudesse tomava sua dor bro .
4355	se eu sinto mt cólica não eu só tomo um remédio q contém morfina .
4356	se eu tivesse alergia a penicilina a minha vida estaria um estrago e eu seria um vegetal .
4357	se eu tivesse no quarto do michael no dia da morte dele eu iria fazer o conrad tomar a merda do propofol stoptheliesaboutmichael .
4358	se eu tomar esse resto de fluoxetina ajuda a parar c tique de tirar td as minhas cascas e sangrar até a morte e parar de tremer a perna hein .
4359	se eu tomar mediformina lexotan valeriana captopril e diazepan será que entro em coma .
4360	se eu tomar só paracetamol minha cólica vai passar .
4361	se eu tomar um dipirona eu já morro pq tenho alergia .
4362	se eu tomei uma porra de um ibuprofeno porque então então a porra da dor não passa porra .
4363	se eu tomo fluoxetina eu morro de tontura se eu não tomo morro de ansiedade o que fazer .
4364	se eu tomo omeprazol eu passo mal e sinto muita dor não só no estômago aí se tomo pantoprazol não sinto nada .
4365	se existe uma vacina contra a morte então continuem gozando e abusando aos defuntos .
4366	se for dipirona eu tenho alergia .
4367	se for dor de estômago toma omeprazol é ótimo .
4368	se for dor de garganta amoxilina mas so indo no medico infecçao urinaria ampicilina mas so indo no medico eu tomei mas eu ne .
4369	se for enjôo ou azia indico o bromoprida ele é tiro e queda rs .
4370	se for enxaqueca minha mãe time o sumatriptano age rápido e dá menos efeito colateral q o cefaliv .
4371	se for só pra dor ibuprofeno .
4372	se fosse doença eu tava tomando fluoxetina desde 1992 .
4373	se isso acontece é pq tem algo no seu estômago dor no corpo pode ser um reflexo de fraqueza por falta de vitamina .
4374	se isso não for doença isso nem é testa é testamento testosterona de teste testado https twitter com fuckingkimii status 797943691734224896 .
4375	se n baixa a febre vo pro plantão n posso toma paracetamol e nem ibuprofeno pq fazem minha pressão subir .
4376	se não for o desavio do paracetamol com coma alcoólico eu não quero .
4377	se não for p tomar glicose amanhã eu nem vou beber mas eu vou beber de raiva vcs n tem noção .
4378	se não me policiar tomo café diuturnamente e omeprazol eventualmente por causa da dor de estômago .
4379	se não melhorar eu faço a cracuda e me furo me punciono e coloco omeprazol endovenoso não sou obrigado a sentir dor .
4380	se não quiser responder tudo bem você toma o que eu tive uma crise de acne quando meu corpo tava se adaptando a paroxetina .
4381	se não tiver alergia toma ibuprofeno .
4382	se não tiver alergia toma nimesulida a cada 8h .
4383	se nem ibuprofeno de 600 mg passa minha cólica devo me preocupar será .
4384	se nimesulida não resolveu acho que só resta esperar a morte mesmo né .
4385	se nunca realmente tocamos nada pq sentimos dor ao tomar vacina horadeporcafé .
4386	se o cara tiver raiva era bom tomar uma vacina .
4387	se possível se tiver à mão toma uma colher de chá de bicarbonato de sódio dissolvida em meio copo d água e tchau azia .
4388	se quando a carol voltar minha cólica não tiver passado eu vou me entupir de dipirona e ir mesmo assim porque senão vou ficar loka .
4389	se quiser eu ainda tenho vários remédios de enjôo o bromoprida .
4390	se resolve melhor a enxaqueca com substâncias que contraiam estes vasos dilatados tipo ergotamina mas se é alérgica a eles .
4391	se soubesse q ia dar alergia não tinha nem tomado essa vacina da dengue .
4392	se tiver mta dor toma ibuprofeno .
4393	se tu nunca fritou afta com bicarbonato de sódio tu n tem noção do que é dor .
4394	se vc fosse no medico pedir remédio ele te daria paracetamol e ibuprofeno pra essa dor .
4395	se vc sentir dor toma um remédio q chama diclofenaco de potácio toma um a cada 8 horas q a dor passa melhor q com nimesulida e etc. se vc sentir muita dor no estomago omeprazol ajuda plasil se for enjoo mas se for muito forte toma dramin e assim .
4396	se você fosse filha da cibele e estivesse doente seus problemas acabaram nimesulida cura ebola câncer aids e todos os tipos de doença .
4397	se você tem problemas com sua memória recomendo que coma abacate e ingira zinco sintético e por favor não vai http fb me 7cfwugk4r .
4398	século 21 e ainda n inventaram uma vacina p cólica .
4399	segue a rotina fica frio dor de dente nath enfia a cara na nimesulida .
4400	seguimos a vida na esperança do nimesulida fazer efeito e a dor de cabeça passar 3 .
4401	segundo a radio caracol situação é mais morte do que de vida mas há uma dificuldade na buscas vamos aguardar .
4402	sei bem como é passei uma semana vivendo de ibuprofeno para diminuir a dor achei que essas porra não iam nascer .
4403	sei bem o que é ter dor de estômago toma um omeprazol que agorinha cê tá boa melhoras viu .
4404	sei que é errado viver de remédios mas vou voltar pra sertralina pq minha ansiedade tá fodendo minha enxaqueca .
4405	sei que tem a naratriptana pra enxaqueca pra enxaqueca mas o único antidepressivo que lembro com o nome parecido é .
4406	sekishike depressão e ansiedade e o escitalopram me deixa mais ansiosa ainda .
4407	sem cafeína com fome e com raiva nem queiram imaginar a pilha que eu tô mlq .
4408	sem condições de secar o cabelo nesse calor com secador .
4409	sem contar o condicionamento físico e a dopamina que você conquista era o que eu mais tava precisando devido a ansiedade nicotina .
4410	sem contar q a nicotina alivia estresse e ansiedade temporariamente mas vcs nao pensam nisso ne nao .
4411	sem contar que nesses dias eu estava sentindo muita dor no estômago que tomei omeprazol durante esses dias .
4412	sem dormir efeito colateral da oxicodona muita enxaqueca e sem nada para ver vou assistir https www instagram com p bk4tzc3hiva .
4413	sem irritação sem dor de cabeça glicose sua linda .
4414	sem paranóia migu dor natural kkk toma algum analgésico ou um anti inflamatório indico nimesulida é muito bom .
4415	semana de provas é diarréia gastrite explosão de espinhas crise nervosa choro come td que vê pela frente omeprazol eu .
4416	semana que a ansiedade apita é omeprazol e chá de camomila o dia todo .
4417	semiftharmony dorflex não anador eu não sei eu tenho problema de estômago e sempre tenho dor buscopan e hidroxido de alumínio .
4418	sempre comi mt doce mas depois das crises de ansiedade passei a comer o triplo deus guarde a minha glicose .
4419	sempre fui resistente a dor acho que posso ser considerada masoquista quando criança nunca chorava para tomar vacina .
4420	sempre fui um vira latas e poesia era o que te dava dependente da nicotina já nem a morte me salvava .
4421	sempre q esqueço de tomar o omeprazol fico com um enjoo horroroso .
4422	sempre que eu passo oleo de ricino no cabelo me da dor de barriga ai smp penso ah mas ele eh um laxante ne mas hj passei oleo de coco .
4423	sempre que eu to com alguma dor mto forte eu fico pensando que nunca vai passar e nenhuma morfina no mundo vai acalmar ela .
4424	sempre tomo ibuprofeno pra colica .
4425	sene araujo eu morro de raiva pq não vejo graça e todo mundo ama voltei a ver pra ver se gosto como vcs tentarei .
4426	sene lucas engenharia dando confusão mas direito não urrei .
4427	sene lucas mais calor assim só sinto quando vejo tuas nudes .
4428	sensivel a td sei q tenho q proteger ela de qlq forma mas ela tem alergia a coleira e eu tenho medo ate da vacina pq ela ja .
4429	senti enjôo com essa glicose aí .
4430	senti tanta dor quando sai da sala de cirurgia tive que tomar duas doses de morfina e uma de dipirona pra passar a dor .
4431	sentindo aquela cólica maravilhosa que parece que nem se eu injetar morfina na feia passa a dor .
4432	sentir cólica e não poder tomar remédio pq 99 9 tem dipirona na composição .
4433	sentir uma cólica tão forte que cheguei ao ponto de tomar a morfina de vovó sim com certeza .
4434	separa uns ibuprofeno pra mim aí to parecendo velha com dor no corpo .
4435	ser apaixonada por cafeína e ter ansiedade é complicado emmm .
4436	ser magro não vacina contra nada aliás desnutrição tb é doença .
4437	ser vegana é estar mto louca numa festa seus amgs tentando de dar glicose nao tem nada que vc coma e eles te dão um sachê de açúcar união .
4438	sera possivel q eu tenho q tomar dipirona na veia p essa colica passar .
4439	será q ficar tomando bicarbonato de sodio pra aliviar a azia mexe com os eletrolito do corpo por exemplo vamo supor q eu beba 3 copo disso .
4440	será q o lindinho vai querer tomar a vacina a vacina que pretende eliminar a dependência de cocaína http migre me uxqcy .
4441	será que a efedrina ta me dando alergia to toda empipocada .
4442	será que dá pra tomar ibuprofeno pra dor de cabeça .
4443	sera que dipirona melhora a cólica .
4444	será que morfina resolve cólica só falta isso pra eu tomar hj .
4445	será que o paracetamol vai resolver minha cólica pq nunca senti tanta cólica e por tantas infinitas horas .
4446	será que se eu tomar 2 omeprazol de uma vez a dor para .
4447	será que se eu tomar dipirona a cólica melhora .
4448	será que se minha namorada tomar a vacina pra febre aftosa ela melhora .
4449	sério aí que dor faz alguma hidratação caseira ou borrifador com glicerina que são coisas bem simples .
4450	serio amo aquele cheirinho de suor masculino no ar pura testosterona lógico que não aqueles podre a suvaco né vamo saber diferencar amores .
4451	serio e o q mesmo vocês pediam nestas manifestações ficadilma não né vai faltar sertralina e fluoxetinano sus para a depressão pós pato https twitter com sudornelles status 807028102958288901 .
4452	serio eu tenho muita colica so passa com nimesulida só que hoje ta demorando .
4453	sério eu tô passando muito mal e não sei se é cafeína ou ansiedade .
4454	serio gnt eu tava chorando de tanta colica hj de manha ai eu tomei ele pq paracetamol n da mais fazendo efeito pra mim .
4455	sério ibuprofeno resolve dor de cabeça .
4456	sério me dá náusea só de pensar em aguentar mais um ano dumas vitamina de peido dessas sendo promovidas só quero meu wolf .
4457	sério mesmo que paracetamol ta me dando alergia .
4458	serio q raiva mds denny .
4459	sério se eu soubesse que topiramato dava tanta náusea assim eu tinha colocado minha vesícula de volta .
4460	sério vai na minha cyborg ganha porque tá mais pesada e tá cheia de testosterona baixar o peso é a morte da cris .
4461	sério vou procurar esse minha cólica doi minhas costas e ja me rendeu 2 desmaio de parar no hospital tomando morfina .
4462	serotonina dopamina ocitocina amor felicidade ansiedade e depressão segundadetremurasdv psicologiaporamor .
4463	sertralina não é a solução mais cabível para a depressão pronto falei .
4464	sertralina nenhuma aguenta minha ansiedade maldito dia que descobri a diferença entre coreia do sul e do norte .
4465	seu amigo das manhãs pode causar dor de cabeça alguns medicamentos e alimentos contêm cafeína e um simples cafezinho pode ser problemão pic twitter com nn8vhqpojz .
4466	seu corpo te acorda por falta de glicose deixa uma barra de chocolate do lado da cama acorde coma e volte a dormir .
4467	seu intestino vai mal cáscara sagrada indicações combate o inchaço melhora o funcionamento do intestino http fb me 3u123pbxi .
4468	seu suor é glicose fim de um fetiche sucinto um sonho morre numa cama remédio e vinho tinto .
4469	sibutramina mandou lembranças p ansiedade pq essa vaca abriu um buraco negro dentro de mim q ta me consumindo .
4470	sibutramina tarja preta tem q ter receita e mais 4 que são fórmulas naturais pra queimar gordura tirar ansiedade etc. sibutramina um inibidor de apetite que pode levar a morte http www atalaianoticias com br sibutramina um inibidor de apetite que pode levar a morte via rede atalaia de comunicação .
4471	sífilis doença milenar curável com poucas doses de penicilina tinha tudo para ser eliminada da face da ter http bit ly 2e8jjcx .
4472	siiim misturar dipirona novalgina com bebidas alcoólicas também dá alucinação lado bom de fazer enf é aprender essas coisas .
4473	sim a cafeina pode dar dor de estômago shsjsjs .
4474	sim amiga pede na farmácia nimesulida fala que você tá com dor receitamos ele no consultório tira a dor como uma luva .
4475	sim e pra nao deixar a glicose com ciume coma mt doce tmb .
4476	sim eu já voltei atrás com o topiramato da enxaqueca agora não tô aguentando já ligamos pra ele ontem .
4477	sim eu sei que omeprazol só se toma em jejum mas vem sentir minha dor no estômago pra ver se não toma umas 3x no dia .
4478	sim kkkkkkkkkkkkk eu ja fiz teste c sabonete líquido de glicerina tudo mas todos me dão alergia kkkkkkkkkkk .
4479	sim nimesulida 100 mg e amoxilina 500 mg amanhã se reduzir o inchaço vou extrair o siso d. sim o que não me dá muita cólica é óleo de rícino mas tô 100 cansada de engolir aquele negocio ruim .
4480	sim por favor pessoalno um minuto de silêncio vamos respeitar a torcida do grêmio sente a mesna dor q os envolvidos na trajédia https twitter com taddeu status 805165555267371008 .
4481	sim sim mas eles receitam o ibuprofeno pra dor enquanto o antibiótico não fez efeito suficiente para a dor sumir .
4482	sim tem cheiro de suor testosterona não tem como descrever https twitter com selenamenstrua status 759928991251705856 .
4483	sim todo remédio de enxaqueca tem cafeína maa eu n sabia disso aí .
4484	simasware o meu é para ansiedade tbm pregabalina .
4485	simplesmente tomei 1 tandrilax 2 dipirona e 1 nimesulida e minha dor nao passa velho isso não é normal caralho nunca tomei tanto remedio .
4486	sinceramente acho dificil ser melhor que bupropiona principalmente no quesito disfunção sexual .
4487	sintomas de falta de vitamina palidez anemia exaustão crónica fraqueza física imunodeficiencia a http fb me 8gcbelsj3 .
4488	situação é mais de vida do que de morte notícia dada pelo repórter da rádio caracol forçachape .
4489	slc como uma dipirona consegue fazer um ser humano sentir uma dor insuportável .
4490	sleepingwithay toma nimesulida pra dor de garganta e liga o secador quente em direção ao ouvido que tá doendo .
4491	smtownglobal queridinha pode ir ali na farmacia comprar um paracetamol pra mim vcs só me dão dor de cabeça justiceforhenrylau .
