Index	Tweet
2989	me entupindo de hidróxido de alumínio e omeprazol e essa porra de dor não passa .
2990	me entupindo de paracetamol por causa dessa cólica do capeta .
2991	me falaram que a dor que estou sentindo nos rins é por causa da nicotina valeeeeu cigarro enriqueci sua empresa pra isso seu lixo fdp .
2992	me indiquem remédio pra ânsia náusea que não da sono além de bromoprida .
2993	me intupi de dipirona não aguento mais de dor .
2994	me livrei da dependência da nimesulida .
2995	me mostrou um video onde um medico diz q omeprazol faz mal mas foi a única coisa q fez a dor do meu estômago sumir .
2996	mebendazol sintomas insônia coceira anal tratado na psiquiatria com clonazepan jornalnacional showdavidapic twitter com i1doqlote0 .
2997	med2 0 remédios para a acne e aparelho podem causar cárie a isotretinoína sempre foi muito usada para comb http bit ly 2aixljl .
2998	médico histórico de doença eu avó e pai diabéticos médico vc já é pré diabéticooooo exame glicose 79 mg dl pic twitter com qgwkhbzkrz .
2999	médicos alertam a mistura de sertralina e álcool pois não só pode levar a pessoa ao coma ou ter lesões cerebrais irreversíveis e a morte .
3000	médicos alertam ainda mais a mistura de sertralina e álcool pois não só pode levar a pessoa ao coma ou ter lesões cerebrais irreversíveis .
3001	melhor combo da vida ibuprofeno protetor auricular quarto escuro espero não te ver de manhã enxaqueca .
3002	melhor combo que vocês respeitam anis camomila sálvia e um nimesulida de acompanhamento uma bolsa de água quente pra cólica .
3003	melhor comprar carvão ativado é bem mais barato pigmentação melhor e não corre risco de alergia qualquer farmácia tem .
3004	melhor que loratadina só cerveja pra curar alergia e sinusite .
3005	melhor remedio pra dor de cabeça no mundo eh o cefalium ou naratriptana passa em minutos pessoascomressacadecarnaval kkkkkkkkkkkkkkkkkkk .
3006	melhor sentir dor de glicose por ressaca de que senti dor de amor não correspondido sextacomoclubesdv .
3007	melhor tateane do mundo minha nossa senhora da sertralina que controle minha ansiedade .
3008	melhora a azia e combate espinhas veja como usar o bicarbonato de sódio fora da culinária https goo gl fb bo0ags .
3009	melhoras miiga toma omeprazol se for dor no estômago .
3010	melhoras para sua dor cuide bem de você bom dia que sua dor possa ir embora omeprazol em jejum ajuda bem https twitter com nan bicalho status 769101311178575872 .
3011	melhoras pede pro medico dar remedio de enxaqueca com cafeína pra ela os outros demoram um pouco pra agir .
3012	melhorei da febre graças a deus estou a base de vitamina c. mellocollela fer minha linda tomar um banho e tomar dipirona e não se cubra com coberta q logo a febre passa ta te amo fica bem .
3013	meloxicam parou a dor .
3014	menina as vezes eu fico c inveja desse povo que tem doença tipo ai tenho alergia a paracetamol acho tão chique af .
3015	menina eu já tomei dois dipirona e nada dessa dor de cabeça passar .
3016	menina ibuprofeno é tipo xarope da mae do cris serve pra quase tudo dor de cabeça garganta calculo renal febre .
3017	menina tomei um desses buscofen faz 1 hora e continuo com cólica dipirona já cansei de tomar .
3018	meninabeu bebi uma dose de tequila aqui que nem uma caixa inteira de pantoprazol vai tirar a dor mais tarde .
3019	meninama6 ah fiquei passando mal sábado e domingo com uma dor de estomago nada que um omeprazol não resolva no mais de boa .
3020	meninas com alergia a nicotina andando em sp favor me add pic twitter com lgg2jkk616 .
3021	meninas que a cólica só passa quando toma 2 ibuprofeno .
3022	meninas que estão com febre me emprestem seus paracetamol .
3023	meninas que são miss enxaqueca e vivem a base de ibuprofeno me add .
3024	meninas que tomam amoxicilina e depois tomam paracetamol sem saber se pode misturar e a ansiedade diz que você vai morrer me add .
3025	meninas que tomam café e tem crise de ansiedade por causa da cafeína .
3026	menino minha dentista passou ibuprofeno 600 mg de 8 em 8 horas e é magico é baratinho ve se tu compra e alivia dor inchaço .
3027	meninogabs se for p estômago toma omeprazol em jejum minha gastro passou um remedinho natural p ansiedade pq minha dor de estômago eh .
3028	meninojedi hsuahsuahsua o nome disso é ansiedade só resolve com 20 mg de fluoxetina d. meninos marrentos parrudos que estão na flor do excesso de testosterona que dão murro em parede na hora da raiva http fb me 7pp2tg3pt .
3029	menó esqueci que tenho alergia a dipirona e tomei agora tô passando mal .
3030	menos mal que minhas crises de abstinência de nicotina se resumem a fome muita e sono de dia pq de noite é crise de ansiedade 48h .
3031	mentira é só falta de serotonina e dopamina coma um chocolate e tome um café já já passa https twitter com vocenaosabiaq status 795801807490523136 .
3032	mentira toma dipirona qnd estiver com cólica você quase morre vomitando .
3033	mesmo tomando fluoxetina tive uma crise de ansiedade .
3034	meta de vida tomar 42 copos de café e ter uma overdose de cafeína com risco de morte .
3035	metade dos brasileiros com diabetes não sabe que tem a doença o aparelho serve para testar a glicose no sang http bit ly 291t8oh .
3036	metformina associada a menor risco de doença neurodegenerativa http fb me 7ud8hy2am .
3037	metformina associada a menor risco de doença neurodegenerativa nova orleans uma nova pesquisa https www instagram com p blv5xvig6aj .
3038	metformina é barato tira a fome e da im enjoo miar fica muuito mais fácil .
3039	meti 40 gotas de novalgina e um comprimido nimesulida de 100 mg ou eu morro ou acabo com essa dor de uma vez kkkkkkkkkkkkkkk mancando de ré .
3040	meu amigo a azia deixou de me acompanhar desde que há 15 anos comecei a tomar omeprazol .
3041	meu cabelo fica maravilhoso com glicerina eu tenho alergia .
3042	meu cérebro está clamando por açúcar glicose acima do normal doce até dar dor de cabeça e depois aquela sede infindável .
3043	meu chefe tem uma alergia respiratória forte e toma vacina todo ano parece que funciona .
3044	meu colesterol e glicose estão perfeitos isso me deixa triste tô longe da morte .
3045	meu creme anti acne provocou ainda mais acne na minha cara isso é a polêmica da vacina all over again .
3046	meu deus a dor nas costas hoje is not on the comic book kd meu ibuprofeno .
3047	meu deus calor e ótimo mais trabalhar e um prédio todo de zinco não é facil .
3048	meu deus comemoração de jogador de vôlei eh aquela coisa cheia de testosterona cara séria de raiva grito eu honestamente n entendo .
3049	meu deus eu vou ter q tomar meio litro de morfina pra curar a ansiedade q eu to pro jogo gothunder .
3050	meu deus preciso começar a tomar fluoxetina se não vou entrar em depressão .
3051	meu deus q fome q sede q dor de barriga e vontade de tomar omeprazol .
3052	meu deus que cólica é esse me arruma uma morfina .
3053	meu deus que dor no estômago não aguento mais tomar omeprazol .
3054	meu deus que dor no estomago tomei omeprazol e nada ta cada dia pior .
3055	meu deus que morte horrível a ressecada da quetiapina .
3056	meu deus tenho metade de um dia e mais um dia de férias segunda meus níveis de dopamina diminuem e a depressão volta .
3057	meu deusssss eu tenho alergia a paracetamol por isso tô toda empolada .
3058	meu diagnóstico de depressão foi baseado em 10 min de conversa o médico não perguntou se eu tinha tendências suicidas e receitou fluoxetina .
3059	meu estomago é todo zoado se eu fico de 3 horas sem comer começa a me dar azia tbem vc toma omeprazol .
3060	meu estomago ja eh fodido ai me da umas dor absurda eu tomo nimesulida ai fode mais .
3061	meu estomago ta retocendo de fome mas tenho que esperar o omeprazol ser absorvido pq é aquele ditado to cheia das doença .
3062	meu irmao acabou de dizer q glicose é uma doença de gordo akakkaakakakakkakakakakaka socorro .
3063	meu loratadina acabou e eu to quase morrendo de tanto espirrar espero que não dê dor de ouvido pq se der eu tô é lascada .
3064	meu médico me tira o rivotril que funcionava e me dá esse zolpidem que só dá depressão sono mesmo nada .
3065	meu medo de pegar caxumba eh tão grande que começa a me dar dor de garganta eu já tomo 20 comprimido de nimesulida .
3066	meu natal foi basicamente gripe febre sem cessar siso nascendo queda de glicose desmaio vômito entre outros nao esperava menos de 2016 .
3067	meu omeprazol acabou e eu não fui buscar ja to até sentindo dor de estômago .
3068	meu organismo reage 100 bem ao ibuprofeno qualquer mísera dor que eu tiver me dá ibuprofeno que passa .
3069	meu pai disse que se a azitromicina não fez a dor de garganta passar eu vou ter que tomar benzetacil to triste .
3070	meu pai do céu que dor no braço da vacina .
3071	meu pai doente eu descontrolando a glicose sentindo a morte me rondando .
3072	meu pai fez café pra mim pq ele acha que a minha dor de cabeça é por falta de cafeina .
3073	meu pai me deu chocolates e uma caixa de omeprazol nesse dia dos namorados isso que é presente ele bem sabe a dor de uma azia .
3074	meu pai me deu remédio com cafeína no lugar de remédio p dor de cabeça puta que pariu .
3075	meu pai qq eu posso trazer pra acabar com sua cólica morfina .
3076	meu pai teve que tomar morfina pra passar a dor da cólica de rins assim parece que as que eu tenho são carinho .
3077	meu paizinho ta com cólica de rim ele chegou a tomar ate morfina eu consigo nem olhar pra ele qnd ele ta assim tadinho .
3078	meu paracetamol acabou e eu estou cheia de cólica tnc né .
3079	meu personal mandou eu tomar algo com alto índice de cafeína antes de ir malhar tomei um copo de coca cola depressao sabadocomoclubesdv .
3080	meu psiquiatra me recomendou fluoxetina para depressão e nossa me dá aquele vazio bizaaaarro no meu peito .
3081	meu remédio favorito pra dor na garganta é ibuprofeno 600 mg me traz alívio e paz interior .
3082	meu remédio pra ansiedade eu chamo de omeprazol pq neh gastrite nervosa eh assim gente .
3083	meu remédio pra cólica acabou agora eu vou ter que tomar um envelope de dipirona .
3084	meu remédio pra dor de cabeça tem cafeína seria isso um problema .
3085	meu remédio pra enxaqueca tem cafeína é só tomar ele e adeus conseguir dormir ou sossegar .
3086	meu remédio tem cafeína ja djaojdsoso é q é enxaqueca mas vlwww .
3087	meu resumo sobre drogas ta quase um quase todas aumentam a dopamina no núcleo acumbens causando dependência e manda lá um benzodiazepínico .
3088	meu rosto ainda esta muito inchado e sinto muita dor ainda não consigo comer nada to na base de soro com glicose .
3089	meu sábado foi bosta tive casamento mas não aguentava de dor de garganta .
3090	meu salário de dezembro vai ser lindo como não é há cerca de 2 anos sou apenas gratidão à paroxetina e à terapia pela ansiedade controlada .
3091	meu sangue chega até a ferver glicose vai lá em cima isso tudo por causa de raiva .
3092	meu sonho é ir pro hospital tomar glicose por estar em coma alcoólico .
3093	meu sonho pra 2017 é tomar a vacina dessa merda de alergia .
3094	meu suor fede a cafeína cara .
3095	meu tio está em coma pro causa da diabetes e dão lição de moral em mim que tenho a glicose melhor do que geral nessa casa .
3096	meu tipo de superação é a base de jesus pq eu mesma n supero nem a vez q tomei mt dipirona e fiquei c alergia .
3097	meus níveis de dopamina e serotonina estão baixos vamos passar os próximos dias sem auto estima e na depressão sim .
3098	meus olhos estão mega inchados não sei se de chorar ou alergia ao remédio que tomei que tinha dipirona .
3099	meus parabéns pra que inventou azitromicina ontem eu não tava conseguindo engolir nem água hoje eu nem sei mais o que é dor de garganta .
3100	meus receptores de adenosina estão cheios de cafeína enquanto o cerebro produz mais receptores qd eu parar de tomar café a enxaqueca vem .
3101	microcefalia causada pela vacina da morte o plano diabólico de redução https youtu be zgyialwz0be via youtube .
3102	miga ela é preguiçosa desde a primeira morte dela gente da gente adora jogar música usada nos cds keep holding on alice etc. miga eu ja paguei meu tratamento com psicologo para aceitar a morte dele .
3103	miga kero sim já tomei 2 remédio acompanhado de vitamina c e ainda continuo com dor de cabeça tosse coriza .
3104	migas me deem outra opção de lax que não seja o lacto porfa quase desmaiei de cólica da última vez e sem ser sene também askanamia .
3105	migo compra nimesulida é mtmt bom e barato genérico faz efeito bem rápido em 30 min a dor passa .
3106	migos vamos fazer uma vaquinha mensalmente pra pagar minha vacina da alergia .
3107	mila tem alergia a dipirona e tomou dorflex .
3108	milenamanso descobri que a alimentação a oxitocina vit c tem correlação e para nutrição psicóloga assim como depressão compulsão 2 .
3109	mily toma nimesulida é um antiflamatorio o único que melhora minha amigdalite horrível ficar sentindo dor .
3110	mimimi vc se acha pq tem depressão vdd ne to ostentando sertralina e rivotril tem cinco caixas de cada aqui em casa quem nunca chorem .
3111	mineralogia nome usado comercialmente para o silicato natural hidratado de cálcio e magnésio de estrutura fibrosa imune ao calor .
3112	minha alergia a dipirona é real to toda impolada .
3113	minha alergia a nicotina tá pior do q eu esperava .
3114	minha alergia à paracetamol só fica pior .
3115	minha alergia atacou ja chapei um loratadina pq ta foda .
3116	minha alergia ta foda queria voltar a tomar vacina p ver se melhoro .
3117	minha alergia vai atacar to vendo alguém tem um loratadina ai .
3118	minha amiga passou num médico e a mulher não diagnosticou e falou que acha q ela tem tag e depressão e receitou topiramato .
3119	minha amiga tirou minha glicose to ate agora com dor no dedo .
3120	minha ansiedade nem com sertralina resolve vsf .
3121	minha cabeça parece que vai explodir tomei a porcaria do paracetamol e ele não desceu tá na minha garganta e já tô sentindo aquelas coisas .
3122	minha cabeça ta explodindo e o único remédio pra dor tem cafeína como proceder .
3123	minha cara minha carolina a saudade ainda vai bater no teto até um canalha precisa de afeto dor n cura com penicilina https twitter com cafecomnoticia status 781604319338586112 .
3124	minha cara minha carolina a saudade ainda vai bater no teto até um canalha precisa de afeto dor não cura com penicilina .
3125	minha carteira tá virada numa farmácia tem paracetamol dramin remédio pra cólica anticoncepcional vai dar pra me drogar legal rsrsrs .
3126	minha cólica é tão forte que daqui a pouco vai ser necessário usar morfina .
3127	minha cólica eh tão forte q tomo 3 remédios juntos atroveran droflex e paracetamol td de uma vez .
3128	minha cólica estava tão forte que eu tomei um dorflex e uma dipirona junto .
3129	minha colica evoluiu de activia pra buscopam pra buscofem agora tô na base de dorflex prox passo é morfina .
3130	minha cólica não passa estou aceitando morfina .
3131	minha colica so ta passando com ibuprofeno 600 mg .
3132	minha dependência de cafeína só aumento a cada dia que passa .
3133	minha dopamina sobe rápido porém desce na velocidade da luz da até umas depressão em questão de segundos .
3134	minha dopamina ta no zero aqui é só depressão .
3135	minha dor de cabeça é falta de cafeína .
3136	minha dor de cabeça é falta de glicose com certeza .
3137	minha dor de cabeça é por falta de cafeína .
3138	minha dor de cabeça era falta de cafeína .
3139	minha dor de cabeça falta de cafeína .
3140	minha dor de cabeça não foi causada por falta de cafeína pesquisando aqui o que pode ter a causado .
3141	minha dor de cabeça passou to um pouco chocada amém ibuprofeno .
3142	minha dor de estômago não quer passar nem com omeprazol .
3143	minha dor de ouvido ta voltando pq eu comprei nimesulida e tomei um 01 comprimido apenas eu so mt ridicula .
3144	minha enxaqueca já me obrigou a tomar topiramato divalproato flunarizina divalproato c sertralina topiramato c sertralina .
3145	minha filha eu to nessa tbm além de alergia é olho coçando tbm haja loratadina .
3146	minha gastrite tá atacada e acabou o bicarbonato de sódio q morte lenta deus .
3147	minha gente e essa minha cólica ein vou tomar 4 ibuprofeno 400 mg pra ver se eu aguento viver ainda pq olhe desnecessário .
3148	minha glicose é tão baixa que se eu fico umas 3h sem comer é dor de cabeça e tontura .
3149	minha glicose esta me dando raiva ja porra toda hora fico tonta .
3150	minha glicose tá 427 por causa de ciúmes e raiva tenho certeza não comi nada hoje .
3151	minha glicose ta 45 logo cedo tava andando apoiando nas paredes de fraqueza dia ja começou uma merda .
3152	minha glicose tá alta e eu tô com cólica meu coração tá disparadasso parece que uma hora ele vai parar .
3153	minha glicose tá alta minha alergia atacando pena q eu não ligo vou comer mais um brigadeiro .
3154	minha glicose tá baixa demais esses dias mano não to aguentando pqp que raiva .
3155	minha glicose ta baixa ou to suando por causa do calor senhooor me ajudaa .
3156	minha glicose ta em 114 mãe fez um delicioso bolo de chocolate passar vontade ou comer o bolo e suportar dor de cabeça eis a questão .
3157	minha glicose tá la em cima tontura n passa .
3158	minha glicose vai às alturas até o final da monografia porque em alguma coisa preciso descontar minha ansiedade né .
3159	minha irmã tem alergia a qualquer remédio que contenha dipirona e ela tomou um que não tinha mas mesmo assim deu reação .
3160	minha irmã teve infecção urinária e o médico receito norfloxacino 400 mg ela não tá sentido dor mais precisa faz tratamento .
3161	minha mae acordou passando mal falei q era alergia mandei tomad loratadina e buscopan melhorou .
3162	minha mãe chegou na minha cama e falou nossa quanto doce agora o resfriado e a dor de garganta passam e a glicose aumenta .
3163	minha mãe disse que pra quem tem enxaqueca é horrível toma cafeina e eu tomo café dms .
3164	minha mãe é viciada em cafeína aí às vezes eu não tô afim de tomar café e ela briga comigo porque vai me dar dor de cabeça .
3165	minha mãe esqueceu de comprar a minha vacina de alergia ai juntou gripe sinusite renite e bronquite pensa numa pessoa fodida .
3166	minha mãe estava a três dias seguidos tomando paracetamol pensando que era o remédio de azia hahahahahahahahahaha .
3167	minha mãe falou pra tomar nimesulida mas nimesulida me da afta resumao to com dor de garganta ainda .
3168	minha mãe foi comprar laratadina alergia me chega em casa com um losartana pressão fiquei tipo a anta trocou os nomes .
3169	minha mãe já chega da derma falando que ela disse que quem tem alergia a dipirona não pode fazer preenchimento aaaaaaaa .
3170	minha mãe já ligou pra farmácia e mandou entregar o ibuprofeno de 600 pensa da felicidade da pessoa que não vai mais sentir cólica .
3171	minha mãe larissa já tomou omeprazol larissa já tomou amoxicilina larissa já tomou remédio pra febre aff. minha mãe manda eu falar com ela e logo em seguida diz vai dormir vai que acordada tu só arranja dor de cabeça .
3172	minha mãe me faz usar bicarbonato de sódio pra clarear os dentes e apesar do leve gosto de morte funciona .
3173	minha mae podia me trazer sei la uma morfina pq eu vou morrer de cólica .
3174	minha mãe quer me dar fluoxetina pra ansiedade será que tomo .
3175	minha mãe sabe que eu tenho alergia a dipirona e ela comprou dipirona pra eu tomar minha mãe quer me matar .
3176	minha mãe só compra dipirona de 500 mg e eu tenho que tomar 2 juntas quando tô com dor de cabeça e às vezes nem passa .
3177	minha mãe só me deu a primeira vacina por isso vivo doente cheia de alergia tenho uns probleminhas mentais culpa da minha mãe .
3178	minha mãe tá me dando droga só pk to cm dor de dente vei oq é xylocaina cm lidocaina isso é droga tenho certeza scrr .
3179	minha mãe tem um problema no pé que é dor continua se eu fosse ela já tinha me matado na morfina .
3180	minha mãe teve coragem de dizer que minhas crises de ansiedade são culpa da nicotina que tem no arguile .
3181	minha mãe toda hora pergunta se estou sentindo dor kkkk coitada mãe e mãe não tem jeito compro remédio fez vitamina gelatina purê e sorvete .
3182	minha mãe vai dar dipirona pra minha cachorra kk ela disse q ela ta cm cólica q ficou mocinha kkkkkkkkkkkkkkkk .
3183	minha mão abriu de novo cortei meu pé to cheia de febre minha cabeça vai explodi e pra completar minha glicose tá baixa .
3184	minha médica disse que essa porra é tão forte que eu teria que tratar com uma vacina manipulada pro meu tipo de alergia .
3185	minha mochila tem muito remédio cruzes kkkk dorflex neosaldina omeprazol 2 de alergia e neosoro puta merda kkkkkk .
3186	minha prima é doente tomou cha de sene e simeticona agora ta aqui gemendo de dor numa vólica qe n consegue nem caminhar .
3187	minha primeira alucinação por hiperdosagem de ibuprofeno https twitter com impossiblecarol status 793902299810828288 .
3188	minha raiva passou eduarda fica me fazendo rir kkk acabou com o meu showzinho q ódio kkkk ainda bem q minha mãe vai fazer vitamina .
3189	minha relaçao de dependencia com loratadina é deploravel .
3190	minha rinite ontem atacou claro que fui tomar loratadina e passar meu colírio aí acordo 6 am com dor nos olhos .
3191	minha sogra deu dipirona pra mim por causa da cólica quase chorei .
3192	minha temperatura ta 37 5 ja tomo dipirona sera tomei tanto remedio pra cólica ontem ja .
3193	minha trindade diária café azia e omeprazol nessa sequência .
3194	minha vacina da raiva é um beijinho seu .
3195	minha vida é comer besteira sentir azia tomar omeprazol .
3196	minha vida eh baseada em omeprazol ansiedade e gastrite kkkkkkkkkkk blz .
3197	minha vida essa eterna dor de estômago que não passa nem depois de 3 omeprazol .
3198	minha vida tem se resumido em dor de dente nimesulida paracetamol e sopa .
3199	minha vida uma mistura de cafeína com ansiedade .
3200	minha vó até trocou o meu sabonete pelo de glicerina sabonete de bb pq é anti alérgico porém n é o sabonete q tá me dando alergia .
3201	minha vó me deu ibuprofeno espero que passe a dor né .
3202	minha xabeca ta doendo mto fui fuma ora passa a dor ta doendo kais cigarro ja nao eh mais meu remedio snrz vo te q larga a nicotina .
3203	minhas colica so morfina mesmo pra aliviar .
3204	mini kit sobrevivência neosoro loratadina fluoxetina omeprazol alergia ansiedade gastrite .
3205	minina ibuprofeno é bom pra cólica né .
3206	minorith eitaa você tem gastrite toma um omeoprazol amanha de manha em jejum e agora tenta tomar algo pra aliviar a dor tipo ranitidina .
3207	miss catuaba acabei de entrar em ciclo da ureia a morte ta bem próxima né .
3208	mistura asma ansiedade nicotina e bronquite .
3209	mito 2 a cafeína aumenta o risco de doença cardíaca fato estudos em ampla escala mostraram que o consumo de http fb me 8f6wppeyr .
3210	mitos a morfina acelera a morte ouça programa da bbc sobre esses e outros mitos em relação a medicamentos para http fb me 5gioke3ni .
3211	mkarolqueiroz tomo lexotan para ansiedade para a agonia das pernas tomo clonazepan paroxetina meu é manipulado e funciona cmg bastante .
3212	mo palha jantar e durmir dor de estômago a noite toda mais tbm é o palha durmir com fome então chapa omeprazol pra dentro .
3213	moço minha boca ta toda mordida e com afta obrigada raiva tá doendo coloquei bicarbonato de sódio doooooiiii .
3214	modinha 2016 ter problemas de autoestima e depressão e ser intolerante a lactose e glúten já vamos fazer uma vacina galera .
3215	more eu tomei um tal de cloridrato de naratriptana eu achei ele maravilhoso tomei logo quando começou a dor dormi e. morfina causa o pior tipo de dependc383ancia afirma especialista .
3216	morfina da mta coceira to quase morrendo me coçando .
3217	morfina dá uma coceira .
3218	morfina dá uma coceira desgraçada .
3219	morrendo de azia e meu omeprazol acabou deus me odeia .
3220	morrendo de dor de cabeça minha glicose tá baixa to sentido .
3221	morrendo de dor de cabeça porém medo de tomar paracetamol e ficar loka como da última vez .
3222	morrendo de dor de cabeça tomei 2 dipirona de 500 mg e entrei em coma acordei só agora todo babado .
3223	morrendo de dor de estômago e meu omeprazol acaba .
3224	morrendo de dor de garganta remédio nimesulida e sorvete .
3225	morrendo de dor na espera da chegada do gabapentina 300 mg na farmácia de alto custo ninguém imagina o que é dor governosp .
3226	morreniiiii de cólica prostaglandinas ômega 6 lipídios diminuição do nível de progesterona descamação do endométrio life sucks .
3227	morrer de dor de estômago ou ir comprar ranitidina a pé eis a questão .
3228	morrer de dor nas costas e não poder tomar ibuprofeno é uma delícia mesmo .
3229	morri de cólica o dia todo tomei duas dipirona s e dois paracetamol s to chapada até agora e a dor não passou .
3230	morro de medo quando eu vejo gente que toma venlafaxina é pesado caro gera dependência com uns efeitos colaterais bizarros .
3231	morte é o mais improvável depois de muitas complicações tem tratamento pra caso grave oseltamivir e zanamivir https twitter com lesbienned status 717532130415403008 .
3232	mossoró está tão quente que estou jogando dipirona no ar para ver se a temperatura abaixa mds se sentindo com calor .
3233	mpf pgr enquanto 20ui insulina nph abaixa a glicose de um paciente tranquilamente 20ui da insulina regular pode botar o paciente em coma .
3234	msma coisa os fumantes de nicotina td do msmo saco odeio odeio cheiro de cigarro aq dentro qndo o vizinho fuma morro de raiva .
3235	mta alucinação não há risperidona q dê conta .
