Index	Tweet
1497	diabetes metformina causa doença nos rins http www diabetesevoce com br blog diabetes metformina causa doenca nos rins pic twitter com 5mpeqoiko1 .
1498	diagnóstico depressão por provas traz imipramina que isso eu aprendi .
1499	dica do dia nunca repito nunca tome omeprazol junto com antialérgico ao invés de parar a queimação no estomago e a coceira elas aumentam .
1500	dica do dia quer cálcio não beba leite coma jabuticaba e cenoura .
1501	dica hipocondríaca do dia antitérmicos ajudam a enfrentar o calor as dipirona etc. dica nunca tomem cápsulas de cafeína e e taurina tô com enjôo pro resto do ano .
1502	dica pra quem fica com fome dor em nf tomem omeprazol ele cria uma pelicula no estomago q impede a queimação e a dor askanamia .
1503	dica se um dia vcs estiverem com dor de garganta façam gargarejo com agua e bicarbonato de sódio sério q troço bom resolve no msm dia .
1504	dieta matinal coma uma manga aqueça 30 min e corra 10 km fumando um spliff adicione uma gota de lsd na guloseima e coma fumando nicotina pic twitter com hbgmyiyxdk .
1505	diga adeus ao inchaço e controle a glicose com esta receita natural http goo gl socwi2 .
1506	diminui a dose do fluoxetina pq tava me dando enjoo mas parece q a dose menor n tá fzd efeito oq eu faço morro de enjoo ou de ansiedade .
1507	diminui a liberação de endorfina serotonina e dopamina além de aumentar a liberação de cortisol que isto tudo trás depressão .
1508	diminuir a ansiedade fuma afu quando tiver bêbada no fim de semana que é mais fácil desassociar o estresse com a nicotina .
1509	dipirona 1g n coma sem comer ou vc desmaia kkjjjkkkl médico passou pra minha crise de sinusite .
1510	dipirona alergia .
1511	dipirona cê pode tomar até se tiver alergia de dipirona nunca faz mal .
1512	dipirona da um calor do caraio .
1513	dipirona é bom p alergia sera .
1514	dipirona é horrível ainda bem que eu tenho alergia kkk está se sentindo melhor .
1515	dipirona é horrível mais é o único remédio que alivia minha cólica .
1516	dipirona é o melhor remédio e tenho alergia .
1517	dipirona me alivia a dor mas esse gosto que deixa na boca sempre acentua a sensação de doença pantominésia .
1518	dipirona na veia meia cartela de buscopan e a cólica não passa pra quê essa dor toda jeová .
1519	dipirona paracetamol piroxicam e a anestesia e eu ainda sinto dor .
1520	dipirona piora a cólica e eu tomei 30 gota trinta .
1521	dipirona pra mim resolve ate colica .
1522	dipirona ranitidina eu sem dor porem dormindo .
1523	dipirona resolve tudooo ta gripada toma umas gotinhas de dipirona ta com cólica dipirona se acidentou quebrou o pescoço trás a dipirona .
1524	dipirona salvando meu sono partiu tentar dormi já que diminuiu a dor .
1525	dipirona serve pra colica é o unico que teeeeeeeeeem .
1526	dipirona serve pra cólica né pq se não servir e eu morrer a culpa não foi minha .
1527	dipirona tirou minha dor mas me deu uma azia .
1528	disfunção erétil disfunçãoerétil sildenafila http pt slideshare net niraldo disfuno ertil 59907139 via slideshare .
1529	disfunção erétil e a tadalafila http fb me vi7ix4tp .
1530	dizem que cafeína ajuda a amenizar a dor .
1531	documentos para viajar com comprovante de vacina contra raiva atestado de saúde fornecido por um veterinário dicasgol petnagol .
1532	doença atinge meia dúzia de berola quero a vacina pra obesidade https twitter com elivieira status 812106662395969536 .
1533	doença conhecida como inveja vontade de ser vc querer estar em seu lugar já tomei vacina contra pessoas assim .
1534	doença crônica e de origem metabólica o diabetes é caracterizado por um aumento anormal do açúcar ou glicose no http fb me 7vkhjyhdx .
1535	doença da gerusa é pq ela foi abduzida por aliens .
1536	doença de cárcere enxaqueca hipertensão e colasterol alto receita doril losartana e https www instagram com p bewrbhpjoqi .
1537	doença de nicotina ué .
1538	doença de parkinson acham dois dicas dela neuroproteção e do aumento natural da dopamina pdf http fb me 1adtghw6n .
1539	doença de parkinson acham dois dicas dela neuroproteção e do aumento natural da dopamina pdf http fb me 1hje5qwd9 .
1540	doença de parkinson acham dois dicas dela neuroproteção e do aumento natural da dopamina pdf http fb me 3kcjwdejo .
1541	doença do caracol raivoso kkk .
1542	doenças hipertrofia usa muito lipidios pelo cresce musculo fraco insuficiencia perda de sal na urina pouca glicose no sangue fraqueza .
1543	doente bem novinha já acordo com dor de estômago cad meu omeprazol .
1544	doente entupida de cafeína com a ansiedade lá em cima só mais uma madrugada qualquer .
1545	doi dms eu acordei umas 10 vezes nessa madrugada de dor tomei quase uma cartela de ibuprofeno hj kkkkkk .
1546	dois comprimidos de dipirona mais um travesseiro vamos ver se a dor de cabeça e o estresse ansiedade angústia passam .
1547	dois da alergia o de dormir faixa preta e paracetamol .
1548	dois dias que não tomo omeprazol e tô o dia todo com dor .
1549	domingo com d de demônio dor depressão dipirona destruição dvamo se mada dmeteoro na terra .
1550	dopamina cardiotônico não digitálico indicação choque séptico cardiogênico e baixo fluxo renal disfunção http fb me z8egsddr .
1551	dopamina e ansiedade .
1552	dopamina em excesso causa depressão .
1553	dopamina latina eu suporto bem a dor mas que tava doendo tava kkkkkkkkkkkkkkkk .
1554	dopamina presente nas suprarrenais indispensável para a atividade normal do cérebro sua ausência provoca a doença de parkinson .
1555	dor colocar bicarbonato de sódio em uma afta .
1556	dor de amor dói mas vcs ja passaram bicarbonato de sódio numa ferida na boca .
1557	dor de barriga segundo dia chá sene é potente até demais af .
1558	dor de bexiga é horrível .
1559	dor de cabeça acabei de tomar naproxeno e insônia mas amei esse texto repost https www instagram com p balvy kr6mv .
1560	dor de cabeça aceito uma massagem e um ibuprofeno .
1561	dor de cabeça acho que é falta de cafeina .
1562	dor de cabeça alguem traz um dipirona pfvr .
1563	dor de cabeça constante devido ao efeito colateral que o lansoprazol está me acusando .
1564	dor de cabeça da porra acho que é falta de cafeina .
1565	dor de cabeça do caralho eu tomei 2 comprimido de paracetamol de 750 mg e daí tasquei um zolpidem pra ver se dormia odeio dor de cabeça .
1566	dor de cabeça dor no estômago sinusite atacada acetilcisteina omeprazol tá maneiro .
1567	dor de cabeça e de garganta ao mesmo tempo é uma desgraça pessoa já engole uma dipirona e come uma pastilha pra garganta aaaaaa .
1568	dor de cabeça e gastrite atacada sdds tomar omeprazol regularmente .
1569	dor de cabeça e muito sono google sintomas de vicio em cafeina procurar .
1570	dor de cabeça e tontura graças a glicose joelho fodido não sei pq mãe reinando que hoje não saio de casa tudo bem bom pra esse sábado .
1571	dor de cabeça é um inferno pra mim depois que adquiri alergia a dipirona e aspirina pq nenhum remedio sem eles funciona pra mim .
1572	dor de cabeça falta de cafeína .
1573	dor de cabeça há quase 3 dias já tomei paracetamol e ibuprofeno alguém da tl tem sugestões .
1574	dor de cabeça ibuprofeno dor no corpo ibuprofeno estress ibuprofeno coração partido uso ibuprofeno ressaca moral ibuprofeno .
1575	dor de cabeça insônia alterações de humor e ansiedade pode ser o resultado da dependência de cafeína .
1576	dor de cabeça ja isso pq ainda não tomei minha cafeina af .
1577	dor de cabeça motivo excesso de cafeína .
1578	dor de cabeça por falta de cafeína .
1579	dor de cabeça por falta de cafeína no corpo .
1580	dor de cabeça por motivos de nicotina .
1581	dor de cabeça pra caralho sem nicotina no corpo a quase 5 dias meu deus me ajuda .
1582	dor de cabeça precisando de uma glicose .
1583	dor de cabeça tomou conta e minha glicose abalada .
1584	dor de cotovelo dói né stalkear a vida alheia minuto a minuto tô começando a ficar com pena fluoxetina tá dando conta não poxa .
1585	dor de dente sofridão horror ibuprofeno .
1586	dor de estômago e meu omeprazol acabou q morte horrível .
1587	dor de garganta e acabou o nimesulida vai tomar no cu que vou ter que passar a noite mal .
1588	dor de ouvido desgraçada e nao quero entra na nimesulida porque me faz meio mal .
1589	dor de ouvido voltando a me infernizar desce uma azitromicina .
1590	dor não cura com penicilina .
1591	dor não cura com penicilina nowplaying meu amor minha flor minha menina de zeca baleiro http spoti fi 1yqe2ia .
1592	dor não dura com penicilina .
1593	dor nas costas falta de vitamina d vício em cafeína e nicotina .
1594	dor no estomago e dor na garganta pantoprazol ou cefalexina ou os dois que será o equivalente á morte súbita .
1595	dor no estômago não a omeprazol que resolva .
1596	dor no estomago nao dormi a noite inteira ja tomei omeprazol e nada .
1597	dor no estômago não é de deus tomei omeprazol e nadaaaaaa .
1598	dor no estômago omeprazol já não faz mais efeito .
1599	dor no estômago ta foda kd meu omeprazol purfa .
1600	dor no estômago tipo acidez aí é bom omeprazol mas demora um pouquinho msm pra ter efeito .
1601	dorflex me dá alergia sou adepto ao paracetamol ou paracetaloka como eu chamo .
1602	dorflex n posso tomar ibuprofeno é o melhor mas n tem como pq mesmo suprimindo uns 80 da dor resta a restrição de movimento .
1603	dorflex vai te dar mais do no estômago ainda ppr conta dos compostos toma omeprazol muito bom pra dor .
1604	dorflexoficial eu tomava dorflex mas tive alergia a dipirona e não posso mais tomar se fizer com paracetamol será maravilhoso .
1605	dormi com óleo de rícino no cabelo e acordeu explodindo de dor de cabeça .
1606	dormindo cm óleo de ricino e óleo de coco na cabeça amanhã cedo já vai dar pra fritar um ovo já cm calor e todo esses óleos na cabeça .
1607	dormir a tarde inteira e ter crises de ansiedade é quase a mesma coisa que cafeína na minha vida .
1608	dormire dormir dormi dorm dor do dop dopa dopam dopami dopamin dopamina .
1609	dps fica morrendo aí com a glicose alta zzzzzzz já cansei de reclamar falo nem mais nd p não arrumar confusão .
1610	dr me deu piroxicam pra dor no braço mas ele nao entende q nem esse nao adianta mais .
1611	drama da noite tomei paracetamol pra dor de cabeça e agora estou com cólica e não posso tomar o tylex .
1612	dres problema de digestão mano uma colherzinha de café de bicarbonato de sodio e mta alada vc da uns burp e nunca mais ouve falar da dor .
1613	dri tem um remedinho pra dor aí na sua bolsa dipirona loratadina motilium omeprazol seakalm seakalm .
1614	droga tô com dor de garganta adivinhem quem vai ficar doente e ainda tô sem nimesulida em casa .
1615	drrecomenda mais oq faço então doi muito é desesperador a nimesulida que faz amenizar a dor .
1616	duas virginiana indignadas pq qdo era a fluoxetina da capsula verde e branca a gt tava de boa e agora com a rosa tamo se fodendo de azia .
1617	dudaggomes lauralvitola febre que não passa e a taxa de glicose tava baixa eu desmaiei no meio do soro .
1618	durante a amamentação n deve se tome alimen acidos tipo refri pq passa cafeina da coca pro leite da cólica e fica mais agitado .
1619	durante o dia niquitin libera doses terapêuticas de nicotina aliviando a ansiedade e outros sintomas da fissura pic twitter com exyxj1onv7 .
1620	durante um ano vou ter que vim de floripa a joinville uma vez por semana pra aplicar uma vacina contra esse tanto de alergia que eu tenho .
1621	durmo fora to sem pantoprazol aí fico todo fodido cheio de cólica legal .
1622	durmo no máximo umas 4h nessa noite descubro que o efeito da penicilina demora 24 48h pra começar agir absolutellyputaço dor novamente .
1623	é a base d ibuprofeno porem é um pozinho fortissimo maravilhoso tomba a dor .
1624	e a dependência do cigarro não fazem uma vacina pq no cigarro e no álcool conseguem arrecadar impostos e isso http fb me 8all7liba .
1625	e a depressão pós obesidade mato com venlafaxina https twitter com pedrofabrini status 697622841206956032 .
1626	é a diva oficial parou de responder deve ter entrado em coma alcoólico alguém por favor aplica glicose na veia dessa pessoa .
1627	é a enxaqueca como resposta por falta da dose diária de cafeína acabo tomando uns 6 copos de café ao longo do dia .
1628	e a febre vitamina c e sono é o que eu preciso .
1629	é a garganta mas todos só passaram remédio p febre aí eu to dando ibuprofeno q é anti inflamatório também .
1630	e agora josé zica ou vacina confusão da zorra http fb me 525zmbkuv .
1631	e agora o twitter me fez descobrir que o edu testosterona ainda existe que morte horrível .
1632	e agora ta tocando um sertanejo pesado dor d corno e a galera bebendo suco e vitamina .
1633	e aí eu fui tomar tramal na veia e falei pra médica que tinha passado a dor só pra não tomar morfina mas não tinha .
1634	e ainda disse que serve pra todas as dores crônicas mas não sempre só qnd tiver a dor e é melhor que dopamina pq eh natural .
1635	e ainda por cima acabou o omeprazol só omeprazol salva a dor de gastrite depois da raiva .
1636	e amanhã vou extrair os sisos minha agenda dessa semana só envolve dor .
1637	é antialérgico vacina nebulização e nada supera essa alergia mt legal né non .
1638	e apesar do escitalopram ter melhorado bem a ansiedade não afetou a depressão aí to preocupada em cagar tudo .
1639	e assim fica mais melhor o calor de matar pic twitter com 6yj4eahipq .
1640	e betametasona na nossa vida haja corticoide hauahau af e nesse calor entao td coçando triste demais .
1641	é bizarro como a cafeína em demasia consegue gerar ataque de pânico e uma ansiedade muito difícil de lidar no meu caso .
1642	é bom não faz como eu q comi pizza to com enxaqueca e só tem tilenol con cafeina ou ibufreno em cada .
1643	é cada raiva q eu passo com esse medidor de glicose q não tá descrito na história .
1644	é calor com marijuana com tabaco e mais calor e cafeína .
1645	e cigarro não vai aliviar tanto a ansiedade pq tu vai adquirir o estresse por falta de uso da nicotina .
1646	e com esse último rt significa que logo menos eu vou morrer de tanta dor de estomago pois gastrite e omeprazol suspenso .
1647	e com sabonete específico pra rosto ou de glicerina nunca usar nada em creme no rosto so em gel comprar protegor anti acne .
1648	e comecei a tomar a sertralina hoje mas tive picos de ansiedade hahahahahaha .
1649	é comum ficar inchada na gravidez o inchaço na gravidez acontece em função do aumento do hormônio progesterona http fb me 4zbg9l3mm .
1650	é das minha mermo e eu acho q lembrava q tu tinha alergia por isso comentei do dipirona q é um aine é alergia q tu tem .
1651	e deus me livre eu ter uma crise de ansiedade e ir pro hospital da última vez precisou de dois enfermeiros e uma dose de morfina .
1652	é dor d cabeça vontade d mijar glicose alta .
1653	é dor de garganta sinusite cólica e enxaqueca alguém me aplica uma morfina .
1654	é então o efeito da prednisona é melhor depois que a alergia acontece .
1655	é escroto demais ter passado a ter alergia a dipirona passava a dor tão rapidinho .
1656	e essa colica maldita que nao passa a preguiça de comprar o nimesulida me fez tomar aquela droga de buscopan que nao serve pra nada .
1657	e essa dor no estômago chegou foi desgraçando tudo cad o lansoprazol .
1658	e essa dor no estômago que não passa desde de cedo depois de 3 omeprazol .
1659	e essa dor no rim maldito sertralina .
1660	e essas porra de remédio de cólica não adianta só o mais forte do paracetamol que alivia .
1661	e esse calor de murchar folha de zinco ce tá é doido .
1662	e esse permanganato de potassio em meio acido e no calor ai em .
1663	e esses áudios de vocês ai vai ficar postando todo dia um pouco tenho ansiedade então avisa logo pra comprar a fluoxetina .
1664	e eu achando que iria fazer um calor zinco gostoso nesses dias .
1665	é eu esquecer de tomar um dia o omeprazol que da azia to de saco cheio dessa gastrite .
1666	é eu ficar ansiosa que vivo à base de omeprazol e remedio p dor de cabeça .
1667	e eu posso ate ter pegado uma doenca daquele cachorro do meu vo e eu n fui tomar vacina .
1668	e eu que achava que a dor de colica de um bêbe era a pior dor que ele podia sentir mas nao a dor da vacina e mil vezes pior .
1669	e eu que achava que alergia a dipirona era frescura .
1670	e eu que nao posso tomar benzetacil pq tenho alergia a penicilina .
1671	e eu que tenho alergia a ibuprofeno .
1672	e eu que tive que tomar duas dipirona pra parar essas colica fora de epoca .
1673	e eu tenho alergia a cefalexina .
1674	e eu tenho alergia a nicotina .
1675	e eu tenho azia diariamente tenho sempre que tomar omeprazol pra não sentir tanto desconforto .
1676	e eu terceiro dia em santos fui parar no hospital e tomei morfina pra colica .
1677	e eu to sem cafeína no sangue desde a hora que acordei e não sei como não desmaiei de dor de cabeça ainda .
1678	e eu vou ter q toma dipirona dnv pq estou com cólica .
1679	é foda eu não posso tomar vacina só miguel tomou mas pelo que li o maior problema é o desconforto só graças a deus .
1680	e horrível dor passo por isso mas o q resolve na maioria das vezes e omeprazol msm .
1681	é impossível que 3 dias de nimesulida não tenham resolvido minha dor de garganta .
1682	é impressionante o efeito da cefalexina tomei ontem hj e já melhorou 50 a dor da minha garganta .
1683	é incrível como a falta de cafeína me faz ter dor de cabeça .
1684	é incrível o que a dependência de cafeína pode causar .
1685	é isso vou ter que enfiar nimesulida nesse corpinho maravilhoso até a dor passar .
1686	e lipídeo é percursor de hormônio sexual quem bane da dieta tem disfunção hormonal a gracyanne não engravida pela testosterona alta .
1687	é mas ouvi dizer que só de mastigar ele já tem a ação parecida com a do ibuprofeno e ajuda na enxaqueca e tal .
1688	é meio incompreensível que eu esteja tomando amoxicilina clavulanato nimesulida e usando gotas no ouvido e ainda ter dor .
1689	e minha bênção de final de ano foi descobrir que as minhas crises de enxaqueca são provocadas por abstinência de cafeína .
1690	e mó engraçado ter dor de cabeça porque está com falta de cafeína eisisks .
1691	é muita dor deus me livre ainda bem q tenho estoque de ranitidina pq se n tava lascada .
1692	é muito estranho ver meu pai com glicose 600 quando o indicado é 70 90 e eu desmaiar e ter tontura por glicose baixa 45 60 .
1693	é muito importante a conservação adequada pois tanto o congelamento quanto o calor anulam a eficiência da vacina http fb me 65ibrsd0q .
1694	e não nos deixei cair no paracetamol mas livrai nos da ansiedade amém .
1695	e não passa bicarbonato de sódio pq pelo q vi só serve pra neutralizar a dor e a cicatrização junto .
1696	e nem vai morrer né já viu alguém morrer por causa da vacina acho que só dá ruim quando dá reação de alergia ou sei la .
1697	e nenhum remédio passa minha cólica a única coisa que faz ela parar é eu tomando dipirona na veia mesmo tô quase indo no hospital .
1698	e nesse frio zinco nada melhor do que o calor de quem vc ama keilianialili home sweet home https www instagram com p bajkzz6hxjd .
1699	e nóis fica como ssumermo c dor de cabeça pela falta de cafeína .
1700	e o armário cheio de ranitidina e dipirona pra dor no estomago e dor de cabeça http fb me 3cf9xb57o .
1701	e o cara vai me dar omeprazol pra passar a dor tipo eu tomo isso em casa sabia querido e não faz mais efeito .
1702	é o contrário parar de fumar diminui a ansiedade http www uai com br app noticia saude 2016 11 15 noticias saude 196786 e o contrario parar de fumar diminui a ansiedade shtml cigarro vícios fumo fumantes nicotina .
1703	e o foda é que eu não trouxe minha querida dipirona e eu tô cheia de medo de sentir cólica forte .
1704	e o medo de no meio disso tudo ter alguma substância que me causa alergia só confio em ibuprofeno .
1705	e o meu ciclo de vida continua frio febre dipirona calor frio febre dipirona calor fr .
1706	e o omeprazol pra dor de estômago .
1707	e o omeprazol que acabou aqui e eu tô me dobrando de dor .
1708	e o pior é que sinto calor em situações assim alguém me dá morfina plmdds .
1709	é o puro stress e aumento na dose de nicotina e pra não ter dor de cabeça aquieta o rabo da sua mina .
1710	e o tizzi 9 disse que bicarbonato de sódio é bom pra azia e eu como pasta de dente preciso urgente ser estudada .
1711	é possível sentir dor de cabeça por tomar muito café .
1712	é pq tinha que tomar a vacina da febre amarela que tava atrasada por isso demorou .
1713	e pra dor só tem dipirona to lascado .
1714	e pra não sentir dor encho o rabo de lidocaína mesmo .
1715	é preciso muita moleza fraqueza debilidade viadagem boiolagem baitolagem falta de testosterona do estado para permitir ocupação de escolas .
1716	é preciso ser muito weird p ter alergia a paracetamol .
1717	é problema de fígado excesso de peso glicose alta tiróide enxaqueca sono em excesso tô quase morta ja .
1718	e provavelmente tontura por falta de glicose .
1719	e qnd vc precisava muito tomar uma vacina e tem alergia a um dos componentes vc faz o que aplica no medo ou chora qq ta contecendo mds .
1720	e qndo a miga ta com colica e eu falo toma aqui esse paracetamol miga é o que .
1721	e quando nao toma teu corpo pede começa por um mal estar e acaba com uma baita dor de cabeça porque o corpo pede pela cafeína .
1722	e quando td vez q vc fica internado quase te matam injetando logo oq eu falo que tenho alergia dipirona .
1723	é que essas tremedeiras podem dar baixa de glicose por ex que é oq leva ao coma alcoólico tem casos assim .
1724	é que fico com raiva mas é normal kkk não vou escurecer que vou me arrepender é esperar agora né kkkkk .
1725	é que omeprazol se toma em jejum normalmente ou pré refeição e eu nem tenho aqui agora mas nunca tomei remédio pra azia msm .
1726	e se eu tiver alergia a dipirona huheyeheue .
1727	e se eu tomo aqueles buscopan dipirona pra cólica eu fico mais mole que pau de tarado .
1728	e se fosse possível se livrar do vício em cocaína pesquisadores desenvolvem vacina contra dependência da droga http portalnoar com e se voce puder se livrar do vicio da cocaina com uma picada pesquisadores desenvolvem vacina .
1729	é sempre assim coé mãe tem novalgina aí mó dor de cabeça tu não tomou café né peraí que eu vou fazer .
1730	é sim tudo culpa do povo que tem dor de cabeça e toma cefalexina kkk só jesus .
1731	e só nimesulida passa minha cólica .
1732	e somos tive um ataque de raiva aqui sabes como e o veterinario n tava la pra eu dar a vacina hoje .
1733	é tanta dor de estomago q se eu tomasse 1 omeprazol pra cada vez ia ter uma overdose .
1734	é tanta dor muscular que acho que nem dipirona resolve meu problema hoje .
1735	é tão sério isso qualquer um pode ter essa doença ela não escolhe classe social santa fluoxetina tem me ajudado http fb me 1u7pwsqk0 .
1736	e tem fluoxetina q dê jeito rt sakasakamori com dilma brasil está em depressão http ossamisakamori blogspot com https twitter com sakasakamori status 694029893504495617 photo 1pic twitter com 1tonyvydfg .
1737	e tenho que tomar vacina de febre amarela .
1738	e tipo nicotina pura uma amor com dor e aventura que prendi tipo a ditadura .
1739	e to com uma azia desgraçada jpa tomei omeprazol mas não passa .
1740	e to pensando em comprar cafeina em capsula mas eu ja tenho ansiedade de afu entao nem sei se vale arriscar .
1741	e to tomando nimesulida pra aliviar a dor e não ter inflamação .
1742	e tomei um treco horroroso pra fazer tive que tomar glicose que morte horrivel .
1743	é triste ser sapatao ter cólica e ter q tomar piroxicam pra passar .
1744	é tudo culpa da minha alergia a dipirona gente e ainda junta com mapa astral aí ferrou perdoaeu hahahaa http fb me 3eksjzesr .
1745	e um ibuprofeno pra passar a dor na garganta socorro .
1746	é uma doença caracterizada pela menstr irregular alta produção do hormônio masculino testosterona e presença d micro cistos nos ovários .
1747	é uma doença dos séculos negros apanhada normalmente no mar e curada com vitamina c. é uma mistura muito loca de ansiedade saudades medo felicidade e mais quinhentas emoçoes .
1748	é uma verdade com alto risco de hemorragia o omeprazol pode impedir sangramento de tubo digestivo potencialmente fatal .
1749	é urgente por favor quando o sertralina 50m chegará tô c uma pessoa c câncer e depressão severa .
1750	é vacina contra raiva .
1751	eae desenvolveu umas paradas em 2016 sim ansiedade maus hábitos glicose .
1752	efedrina pra que se nois tem febre e sua pra carai .
1753	efeito colateral do meu querido zolpidem alucinação .
1754	efeito rivotil olanzapina confusão entre dia e noite desconexão da realidade https twitter com fegomes74 status 717130253387350016 .
1755	efeitos colaterais da azitromicina di hidratada vaginite inchaço da vagina e cefaléia dor de cabeça qual será que eu vou ter primeiro .
1756	efeitos da quetiapina sobre as plaquetas na depressão maior http www medcenter com contentnews aspx id 231067 emkt 1 langtype 1046 .
1757	efeitos secundários de zolpidem denuncie qualquer novo ou piora dos sintomas ao seu médico tais como depressão ansiedade .
1758	égua muito triste passar por isso de vez em quando a dor no estômago ataca mas eu insisto no café e me entupo de omeprazol .
1759	eh serio eu vou ter que tomar um bicarbonato de sódio pq o meu estomago ta assim fervilhando igual um caldeirão de raiva .
1760	eh sim nortriptilina são classe a para enxaqueca e dor crônica .
1761	ehhh vamo a drogarno con nafazolina puta alergia .
