Sentença	 Span_1 	 Span_2 
além da cólica minha alergia atacou ou seja a base de ibuprofeno e antialergico .	ibuprofeno	alergia
almoçando nimesulida p dor d dente .	nimesulida	dor
krlh q dor pqp fui toma vitamina me deixou mas fraca ainda nn to aguentando nem fica em pé .	vitamina	dor
natcfc miga alergia micose é assim mesmo só pode usar esses sabonetes de glicerina hipoalergênicos só tenho usado desses a um mês .	glicerina	alergia
cadê aquela vacina para dor seu farmaceutico se eu desmaiar da nada não .	vacina	dor
pensei que ter alergia à camarão à dipirona e à qualquer metal já era suficiente mas agora descubra que exercício tmb me dá alergia .	dipirona	alergia
pensei que ter alergia à camarão à dipirona e à qualquer metal já era suficiente mas agora descubra que exercício tmb me dá alergia .	dipirona	alergia
comi um bombom e já senti a glicose entrando no meu sangue e a azia se revirando na minha garganta .	glicose	azia
meu deus preciso começar a tomar fluoxetina se não vou entrar em depressão .	fluoxetina	depressão
olá dor no estômago seja bem vinda mas saiba que vou tomar omeprazol .	omeprazol	dor
mal sai de uma gripe e dor de cabeça de 4 dias e já entro numa cólica cavernal que nem tomando morfina resolve .	morfina	gripe
mal sai de uma gripe e dor de cabeça de 4 dias e já entro numa cólica cavernal que nem tomando morfina resolve .	morfina	dor de cabeça
estou passando por uma crise de ansiedade right now mds eu nunca quis tanto um comprimido de fluoxetina na minha vida .	fluoxetina	ansiedade
eu deitada no sofá e meu irmão pq vc tá ai tá passando mal eu n to com calor pq a pergunta ele sla ne esse tanto de paracetamol q. eu desencadiei alergia a cataflan e dipirona dai quase morri por causa dessa porra medico falou q dei sorte .	paracetamol	alergia
eu deitada no sofá e meu irmão pq vc tá ai tá passando mal eu n to com calor pq a pergunta ele sla ne esse tanto de paracetamol q. eu desencadiei alergia a cataflan e dipirona dai quase morri por causa dessa porra medico falou q dei sorte .	paracetamol	com calor
eu deitada no sofá e meu irmão pq vc tá ai tá passando mal eu n to com calor pq a pergunta ele sla ne esse tanto de paracetamol q. eu desencadiei alergia a cataflan e dipirona dai quase morri por causa dessa porra medico falou q dei sorte .	dipirona	alergia
eu deitada no sofá e meu irmão pq vc tá ai tá passando mal eu n to com calor pq a pergunta ele sla ne esse tanto de paracetamol q. eu desencadiei alergia a cataflan e dipirona dai quase morri por causa dessa porra medico falou q dei sorte .	dipirona	com calor
toma uma dipirona que ela que é boa pra febre alta o ibuprofeno é melhor anti inflamatório .	ibuprofeno	febre alta
toma uma dipirona que ela que é boa pra febre alta o ibuprofeno é melhor anti inflamatório .	anti	febre alta
toma uma dipirona que ela que é boa pra febre alta o ibuprofeno é melhor anti inflamatório .	dipirona	febre alta
tava morrendo de dor da tendinite tomei dois nimesulida agora com dor de estômago fortíssima .	nimesulida	dor
tava morrendo de dor da tendinite tomei dois nimesulida agora com dor de estômago fortíssima .	nimesulida	dor
tava morrendo de dor da tendinite tomei dois nimesulida agora com dor de estômago fortíssima .	nimesulida	tendinite
bárbara paz retorna ao teatro após morte de seu marido hector babenco gata em teto de zinco quente está e http migre me uqvyy .	zinco	morte
após 4 dias sem cafeína eis o resultado 1 de boa 2 de boa 3 dor de cabeça infernal 4 dor em todos os músculos do corpo .	cafeína	dor de cabeça
após 4 dias sem cafeína eis o resultado 1 de boa 2 de boa 3 dor de cabeça infernal 4 dor em todos os músculos do corpo .	cafeína	dor
minha rinite ontem atacou claro que fui tomar loratadina e passar meu colírio aí acordo 6 am com dor nos olhos .	loratadina	rinite
minha rinite ontem atacou claro que fui tomar loratadina e passar meu colírio aí acordo 6 am com dor nos olhos .	loratadina	dor nos olhos
ah desculpa eu achei q vc tivesse dito q te dava enjoo e já supus q fosse metformina .	metformina	enjoo
porém ela é alergia a dipirona e eu como boa química fui por na fórmula o remédio pra saber a composição .	dipirona	alergia
chá de maracujá diminui a ansiedade insônia e pode ajudar a diminuir os níveis de colesterol e glicose http fb me 4zdhdbyra .	glicose	ansiedade
chá de maracujá diminui a ansiedade insônia e pode ajudar a diminuir os níveis de colesterol e glicose http fb me 4zdhdbyra .	glicose	insônia
fui dormir tarde e ainda tomei loratadina quase entro em coma .	loratadina	coma
ai que dor no coração gastar uma fortuna com vitamina .	vitamina	dor
como que eu vou apresentar uma matéria na qual eu levei dependência no segundo ano e não sei nem falar permanganato de potássio .	permanganato de potássio	dependência
já tive cólica renal uma dúzia de vezes gosto nem de lembrar numa delas tão forte tive q tomar morfina .	morfina	cólica renal
600 mg de ibuprofeno pra ver se essa dor alivia porque o buscopan não faz mais nem cócegas .	buscopan	dor
600 mg de ibuprofeno pra ver se essa dor alivia porque o buscopan não faz mais nem cócegas .	ibuprofeno	dor
prova de amor entra em coma alcoolico que eu entro junto com vc unidos na glicose .	glicose	coma
menino minha dentista passou ibuprofeno 600 mg de 8 em 8 horas e é magico é baratinho ve se tu compra e alivia dor inchaço .	ibuprofeno	dor
menino minha dentista passou ibuprofeno 600 mg de 8 em 8 horas e é magico é baratinho ve se tu compra e alivia dor inchaço .	ibuprofeno	inchaço
nessalbino nenhum dos dois kk paracetamol é pra febre e nimesulida pra dor de garganta toma multigrip que é excelente .	paracetamol	dor de garganta
nessalbino nenhum dos dois kk paracetamol é pra febre e nimesulida pra dor de garganta toma multigrip que é excelente .	paracetamol	febre
nessalbino nenhum dos dois kk paracetamol é pra febre e nimesulida pra dor de garganta toma multigrip que é excelente .	multigrip	dor de garganta
nessalbino nenhum dos dois kk paracetamol é pra febre e nimesulida pra dor de garganta toma multigrip que é excelente .	multigrip	febre
nessalbino nenhum dos dois kk paracetamol é pra febre e nimesulida pra dor de garganta toma multigrip que é excelente .	nimesulida	dor de garganta
nessalbino nenhum dos dois kk paracetamol é pra febre e nimesulida pra dor de garganta toma multigrip que é excelente .	nimesulida	febre
as vezes eu to chorando de falta da pessoa mas n chamo devido ao orgulho meudeus q raiva d mim mesna .	mesna	raiva
as vezes eu to chorando de falta da pessoa mas n chamo devido ao orgulho meudeus q raiva d mim mesna .	mesna	chorando
ontem tomei 2 frascos de soro no hospital e fiquei com o olho inchado por causa do dipirona que nem sabia que tinha alergia .	dipirona	alergia
ontem tomei 2 frascos de soro no hospital e fiquei com o olho inchado por causa do dipirona que nem sabia que tinha alergia .	soro	alergia
to fumando tanto q meu suor cheira a nicotina .	nicotina	suor
bora tomar bicarbonato de sódio pra azia pq ta mais barato que remédio .	bicarbonato de sódio	azia
tá melhor infecção intestinal então tomou buscopan na veia e outro pra enjôo e bromoprida tá dormindo agora .	bromoprida	enjôo
tá melhor infecção intestinal então tomou buscopan na veia e outro pra enjôo e bromoprida tá dormindo agora .	bromoprida	infecção
tá melhor infecção intestinal então tomou buscopan na veia e outro pra enjôo e bromoprida tá dormindo agora .	buscopan	enjôo
tá melhor infecção intestinal então tomou buscopan na veia e outro pra enjôo e bromoprida tá dormindo agora .	buscopan	infecção
a fluoxetina serve para o tratamento de casos de depressão bulimia nervosa e do transtorno obsessivo compulsivo .	fluoxetina	transtorno obsessivo compulsivo
a fluoxetina serve para o tratamento de casos de depressão bulimia nervosa e do transtorno obsessivo compulsivo .	fluoxetina	depressão
fernandaellend nimesulida alivia a dor p crl sofro c amigdalite tb .	nimesulida	dor
fernandaellend nimesulida alivia a dor p crl sofro c amigdalite tb .	nimesulida	amigdalite
já tomei um dorflex e um remédio duplo de paracetamol cafeína e a dor não passou .	dorflex	dor
já tomei um dorflex e um remédio duplo de paracetamol cafeína e a dor não passou .	cafeína	dor
já tomei um dorflex e um remédio duplo de paracetamol cafeína e a dor não passou .	paracetamol	dor
me entupindo de hidróxido de alumínio e omeprazol e essa porra de dor não passa .	omeprazol	dor
me entupindo de hidróxido de alumínio e omeprazol e essa porra de dor não passa .	hidróxido de alumínio	dor
eu mesmaaaaa minha garganta dói tanto que tá doendo até o ouvido tive febre e tudo tá tomando que antibiótico to tomando nimesulida https twitter com heyfeminazi status 809340021052411904 .	nimesulida	febre
menina eu sou a loka q come sem fome apenas por ansiedade ando tomando fluoxetina consegui a receita indo no médico .	fluoxetina	ansiedade
menina eu sou a loka q come sem fome apenas por ansiedade ando tomando fluoxetina consegui a receita indo no médico .	fluoxetina	fome
novo método pra evitar que o cão internado não coma o equipo passar dipirona no mesmo tiro e queda haha .	dipirona	coma
deixa eu tomar meu ibuprofeno se não essa dor vai me acompanhar no meu sonho .	ibuprofeno	dor
é a base d ibuprofeno porem é um pozinho fortissimo maravilhoso tomba a dor .	ibuprofeno	dor
mas tomei dipirona e agora passou porém tô sentindo uma azia desgraçada .	dipirona	azia
uma que o cigarro fica ruim duas que minha ansiedade generalizada ta sendo descontada em outra coisa além da fluoxetina comida .	fluoxetina	ansiedade
fora nimesulida qual é a sugestão para curar uma dor de garganta pesada .	nimesulida	dor de garganta
toma nimesulida acho q é isso q alivia a dor água morna com vinagre tbm mas sem bochechar só deixa a agua na boca .	nimesulida	dor
toma nimesulida acho q é isso q alivia a dor água morna com vinagre tbm mas sem bochechar só deixa a agua na boca .	agua	dor
agatha é um bebê muito amorzinho não é de chorar não sentiu cólica toma vacina de boa mas quando tá com fome ou muito sono sai de baixo .	vacina	sono
agatha é um bebê muito amorzinho não é de chorar não sentiu cólica toma vacina de boa mas quando tá com fome ou muito sono sai de baixo .	vacina	fome
kkkkkk jaja eu te mando a foto dele o meu tinha mt cafeína e aquilo mexeu cmg até q fui parar no hospital c enxaqueca .	cafeína	enxaqueca
abraçar aumenta a oxitocina do corpo substância q reduz os estados d stress e ansiedade aumentando a felicidade e o bem estar me abracem .	oxitocina	ansiedade
boa noite amigos flavinha está melhor graças a deus sem febre dormiu bem está com a glicose alta difícil http fb me 3ftaj8y8o .	glicose	febre
boa noite só pra quem tem dor de estômago por causa do café e engole o omeprazol com café obrigada .	omeprazol	dor
cuidado q ela não tomou vacina contra a raiva https twitter com coe mylle status 814261257016582144 .	vacina	raiva
só tomo ibuprofeno amigos vivem dizendo que é enxaqueca e tem que ir no médico pra ver remédio diferente mas a preguiça ela .	ibuprofeno	enxaqueca
dipirona é horrível ainda bem que eu tenho alergia kkk está se sentindo melhor .	dipirona	alergia
é sempre assim coé mãe tem novalgina aí mó dor de cabeça tu não tomou café né peraí que eu vou fazer .	novalgina	dor de cabeça
sou resistente a cafeína devido a remédios de alergia .	cafeína	alergia
vei meu remedio de enxaqueca tem 100 mg de cafeína essa porra vai me matar .	cafeína	enxaqueca
além de ansiedade eu tenho glicose baixa .	glicose	ansiedade
to com tanta raiva que fui medir a glicose da minha mãe quase mutilei o dedo dela .	glicose	raiva
tomei 2g de dipirona e 550 mg de naproxeno torcendo pra com essa bomba de remédios minha dor de cabeça passe .	naproxeno	dor de cabeça
tomei 2g de dipirona e 550 mg de naproxeno torcendo pra com essa bomba de remédios minha dor de cabeça passe .	dipirona	dor de cabeça
anakgalvao mano tu engoliu ar de bicarbonato de sódio com vinagre d vinho faz sentido vc tar com dor de cabeça .	bicarbonato de sódio	dor de cabeça
paracetamol é forte pra caramba se essa dor não melhorar eu desisto .	paracetamol	dor
eu tava aqui pensando eu sou alergia a capsaicina então se alguem me atingir com spray de pimenta eu to mto fodida .	spray	alergia
eu tava aqui pensando eu sou alergia a capsaicina então se alguem me atingir com spray de pimenta eu to mto fodida .	capsaicina	alergia
godipiani o filme é absurdamnt bobo e no meio desse quartel general da morte pós apocalíptico a ringer consegue fazer maquiagem é curioso .	ringer	morte
se n baixa a febre vo pro plantão n posso toma paracetamol e nem ibuprofeno pq fazem minha pressão subir .	paracetamol	febre
se n baixa a febre vo pro plantão n posso toma paracetamol e nem ibuprofeno pq fazem minha pressão subir .	ibuprofeno	febre
se n baixa a febre vo pro plantão n posso toma paracetamol e nem ibuprofeno pq fazem minha pressão subir .	pro	febre
bemestar tenho muita dor na nuca e tomo dipirona muito se que estou tendo um mal sono ou é estresse .	dipirona	dor
bemestar tenho muita dor na nuca e tomo dipirona muito se que estou tendo um mal sono ou é estresse .	dipirona	sono
bemestar tenho muita dor na nuca e tomo dipirona muito se que estou tendo um mal sono ou é estresse .	dipirona	estresse
kefera tem alergia a dipirona .	dipirona	alergia
por causa da vacina a minha cachorra está com febre e toda moidinha .	vacina	febre
nossa eu coloquei bicarbonato de sódio na minha afta e eu tô sentindo a dor passando por todo o meu corpo .	bicarbonato de sódio	dor
100or glicose 289 pqp deve ser por isso o edema nos pés e tonturas constantes .	glicose	tonturas
100or glicose 289 pqp deve ser por isso o edema nos pés e tonturas constantes .	glicose	edema
o plano era aproveitar a dor de cabeça para dormir mas eu tomei um comprimido de ibuprofeno e estou acordada sem dor .	ibuprofeno	dor
o plano era aproveitar a dor de cabeça para dormir mas eu tomei um comprimido de ibuprofeno e estou acordada sem dor .	ibuprofeno	dor de cabeça
nimesulida se a dor for muito forte arcoxia mas pro arcoxia precisa de receita em duas vias .	arcoxia	dor
nimesulida se a dor for muito forte arcoxia mas pro arcoxia precisa de receita em duas vias .	arcoxia	dor
nimesulida se a dor for muito forte arcoxia mas pro arcoxia precisa de receita em duas vias .	nimesulida	dor
nimesulida se a dor for muito forte arcoxia mas pro arcoxia precisa de receita em duas vias .	pro	dor
queensregent gente cuidado q teve uma pesquisa q mostrava q omeprazol causa depressão eu tomava tb até ver isso .	omeprazol	depressão
se eu morrer foi porque tomei 100 mg de nimesulida com 40 mg de piroxcan e a dor não diminuiu em nada me salva jesus .	nimesulida	dor
tu provocas me a libertação de norepinefrina e dopamina hormonas associadas à depressão .	norepinefrina	depressão
tu provocas me a libertação de norepinefrina e dopamina hormonas associadas à depressão .	dopamina	depressão
pela segunda vez esse mês quase todo dipirona do soro ia morrer mano alergia dessa bosta é foda .	dipirona	alergia
pela segunda vez esse mês quase todo dipirona do soro ia morrer mano alergia dessa bosta é foda .	soro	alergia
essa vacina antitetânica e mandada tô até agora com dor tnc .	vacina	dor
olha pra minha cara de 6 quimioterapia 5 atg 15 dias de amicacina entre a vida e a morte querer ver alguem morrer sos .	amicacina	morte
quando eu sinto dor tomo nimesulida é antiinflamatório e sempre passa vai espero que tu consiga 3 .	nimesulida	dor
eu não sei vocês mas se tem coisa q é pura nitroglicerina pra eu conseguir o q eu quero é a raiva não há quem me segure 100 sangue no olho .	nitroglicerina	raiva
toma nimesulida ajuda muito na dor .	nimesulida	dor
ou morro de insegurança ou morro de ansiedade de omeprazol essas altura do campeonato não dá mais .	omeprazol	ansiedade
esse calor tava bom pra fazer um amor gostosinho imagina fazer um amor em baixo essa telha de zinco .	zinco	calor
fora se nao der dor tomar o ibuprofeno .	ibuprofeno	dor
meu deus q fome q sede q dor de barriga e vontade de tomar omeprazol .	omeprazol	sede
meu deus q fome q sede q dor de barriga e vontade de tomar omeprazol .	omeprazol	fome
meu deus q fome q sede q dor de barriga e vontade de tomar omeprazol .	omeprazol	dor
minha mãe foi comprar laratadina alergia me chega em casa com um losartana pressão fiquei tipo a anta trocou os nomes .	losartana	alergia
único remedio que eu tomo na vida é o buscofem tomava o esc escitalopram pra crise de ansiedade mas n resolvia nada parei .	buscofem	ansiedade
único remedio que eu tomo na vida é o buscofem tomava o esc escitalopram pra crise de ansiedade mas n resolvia nada parei .	escitalopram	ansiedade
passe uma junção de pomadas cetoconazol neomicina se não funcionar pode preparar a morte etc. passei a madrugada morrendo de azia nem o omeprazol deu jeito .	neomicina	morte
passe uma junção de pomadas cetoconazol neomicina se não funcionar pode preparar a morte etc. passei a madrugada morrendo de azia nem o omeprazol deu jeito .	neomicina	azia
passe uma junção de pomadas cetoconazol neomicina se não funcionar pode preparar a morte etc. passei a madrugada morrendo de azia nem o omeprazol deu jeito .	omeprazol	morte
passe uma junção de pomadas cetoconazol neomicina se não funcionar pode preparar a morte etc. passei a madrugada morrendo de azia nem o omeprazol deu jeito .	omeprazol	azia
passe uma junção de pomadas cetoconazol neomicina se não funcionar pode preparar a morte etc. passei a madrugada morrendo de azia nem o omeprazol deu jeito .	cetoconazol	morte
passe uma junção de pomadas cetoconazol neomicina se não funcionar pode preparar a morte etc. passei a madrugada morrendo de azia nem o omeprazol deu jeito .	cetoconazol	azia
com esse calor só dá temperar frango e colocar encima da chapa de zinco .	zinco	calor
aí que dor passa óleo de ricino mana dizem que é bom .	óleo	dor
5 feira começo a tomar fluoxetina espero q melhore minha ansiedade askanamia askanaemia .	fluoxetina	ansiedade
entre formas de curar a azia rápido água com bicarbonato de sódio bicho é azia não vontade de morrer .	bicarbonato de sódio	azia
entre formas de curar a azia rápido água com bicarbonato de sódio bicho é azia não vontade de morrer .	bicarbonato de sódio	azia
o que trouxemos para o século 21 depressão ansiedade má alimentação omeprazol by maisa abdalla .	omeprazol	ansiedade
o que trouxemos para o século 21 depressão ansiedade má alimentação omeprazol by maisa abdalla .	omeprazol	depressão
após morte de bebês frança deixa de recomendar vacina rotavírus http fb me 14zap6ktm .	vacina	morte
deixa qualquer um com psicologico abaladissimo sono atrasadoc e dependencia de cafeina .	cafeina	sono
e provavelmente tontura por falta de glicose .	glicose	tontura
caraca hj vai ser um dia de dor cólica três vacina de uma vez mais meu joelho arrebentado slc .	vacina	dor
cólica dor da vacina no braço to como .	vacina	dor
eu desisti no 3o episódio não aguento aquela japa da depressão porra não tem lítio em marte .	lítio	depressão
esa dopamina que no te deja ni sentir calor .	dopamina	calor
paracetamol em excesso da azia .	paracetamol	azia
porém febre não faz parte disso nem enjoo crtz a minha glicose tá alta .	glicose	enjoo
porém febre não faz parte disso nem enjoo crtz a minha glicose tá alta .	glicose	febre
estou precisando de um midazolam pra controlar essa ansiedade pra prova que é só 16hra eta porra .	midazolam	ansiedade
quem vai no show do henrique e juliano nesse frio do caralho onde o lugar até no calor é frio eu mesna haaha .	mesna	calor
tô gripada com dor na garganta e com glicose baixa não falta mais nada né .	glicose	dor
se eu tomar um dipirona eu já morro pq tenho alergia .	dipirona	alergia
tds dizem q sou fofa quando estou c raiva va uso nitroglicerina e fósforo então n me deixairritada e tweet direito 2 tgs lovebts .	nitroglicerina	raiva
ah hoje foi um dia incrível cheguei a conclusão que eu realmente tenho alergia de dipirona .	dipirona	alergia
fluoxetina na veia depressão na cadeia .	fluoxetina	depressão
sleepingwithay toma nimesulida pra dor de garganta e liga o secador quente em direção ao ouvido que tá doendo .	nimesulida	dor de garganta
tava morrendo de dor tomei 2 comprimidos de nimesulida e ferrei no sono tô me sentindo renovado .	nimesulida	sono
tava morrendo de dor tomei 2 comprimidos de nimesulida e ferrei no sono tô me sentindo renovado .	nimesulida	dor
lá vai eu beber de novo hj pra aliviar essa dor pq se tomar ibuprofeno n pode beber .	ibuprofeno	dor
post a ansiedade por comida e a dopamina por dr estevam luiz um dos grandes desafios de https www instagram com p bgalxlbvl9g .	dopamina	ansiedade
seguimos a vida na esperança do nimesulida fazer efeito e a dor de cabeça passar 3 .	nimesulida	dor de cabeça
eu tenho alergia a dipirona to tomando paracetamol brigada amiga .	dipirona	alergia
eu tenho alergia a dipirona to tomando paracetamol brigada amiga .	paracetamol	alergia
fiz combo de remédio hj dipirona neosaldina e omeprazol nd passou minha azia e dor de cabeça .	neosaldina	dor de cabeça
fiz combo de remédio hj dipirona neosaldina e omeprazol nd passou minha azia e dor de cabeça .	neosaldina	azia
fiz combo de remédio hj dipirona neosaldina e omeprazol nd passou minha azia e dor de cabeça .	omeprazol	dor de cabeça
fiz combo de remédio hj dipirona neosaldina e omeprazol nd passou minha azia e dor de cabeça .	omeprazol	azia
fiz combo de remédio hj dipirona neosaldina e omeprazol nd passou minha azia e dor de cabeça .	dipirona	dor de cabeça
fiz combo de remédio hj dipirona neosaldina e omeprazol nd passou minha azia e dor de cabeça .	dipirona	azia
não sei mais com que sabonete eu tomo banho ja usei todo tipo e tenho alergia ate os que nao tem glicerina que odio .	glicerina	alergia
ia ir no couto mas com essa dor o unico lugar que eu vou é pra cama com meu omeprazol .	omeprazol	dor
nunca tinha visto alguém com alergia a dipirona https twitter com gatinhawn status 777384157680902144 .	dipirona	alergia
ivernando não pretendo machucar ngm só passar abraços liberando oxitocina estimulando o pensamentoe assim a depressão .	oxitocina	depressão
minorith eitaa você tem gastrite toma um omeoprazol amanha de manha em jejum e agora tenta tomar algo pra aliviar a dor tipo ranitidina .	ranitidina	gastrite
minorith eitaa você tem gastrite toma um omeoprazol amanha de manha em jejum e agora tenta tomar algo pra aliviar a dor tipo ranitidina .	ranitidina	dor
nossa só com omeprazol e pepsamar pra aguentar essas azia defendendo futebol do inter .	pepsamar	azia
nossa só com omeprazol e pepsamar pra aguentar essas azia defendendo futebol do inter .	omeprazol	azia
égua muito triste passar por isso de vez em quando a dor no estômago ataca mas eu insisto no café e me entupo de omeprazol .	omeprazol	dor
tomei remédio p dor de cabeça um omeprazol metade de um comprimido de melatonina e um xarope .	xarope	dor de cabeça
tomei remédio p dor de cabeça um omeprazol metade de um comprimido de melatonina e um xarope .	omeprazol	dor de cabeça
descobri que eu teria que tomar 120 mg de propranolol pra ansiedade tremor mas eu tomo só 40 mg é .	propranolol	ansiedade
descobri que eu teria que tomar 120 mg de propranolol pra ansiedade tremor mas eu tomo só 40 mg é .	propranolol	tremor
tomei a vacina de febre amarela aquela dorzinha chata no braço agr é já to sentindo uma dor de cabeça chegando .	vacina	dor de cabeça
tomei a vacina de febre amarela aquela dorzinha chata no braço agr é já to sentindo uma dor de cabeça chegando .	vacina	febre
nossa eu tomando glicose vai ser por coma kshsjsh .	glicose	coma
ter alergia de dipirona tudo bem né mas de paracetamol já é demais p mim .	dipirona	alergia
ter alergia de dipirona tudo bem né mas de paracetamol já é demais p mim .	paracetamol	alergia
bicarbonato de sodio clareia os dentes tbm e é bom pra fazer bochechos qndo vc ta com dor de garganta .	bicarbonato	dor de garganta
bicarbonato de sodio clareia os dentes tbm e é bom pra fazer bochechos qndo vc ta com dor de garganta .	bicarbonato	dentes
casa de madeira calor morno barulho de chuva no teto de zinco a janela aberta .	zinco	calor
previsão pra dezembro daí volto com laser pra cicatriz e manchas e zinco pra toda vida acne da mulher adulta .	zinco	acne
previsão pra dezembro daí volto com laser pra cicatriz e manchas e zinco pra toda vida acne da mulher adulta .	zinco	cicatriz
agora tô morrendo de tanta dor no estômago e cadê o meu omeprazol .	omeprazol	dor
vou voltar com a fluoxetina ou o citalopram porque minha ansiedade ainda vai me matar um dia .	citalopram	ansiedade
vou voltar com a fluoxetina ou o citalopram porque minha ansiedade ainda vai me matar um dia .	fluoxetina	ansiedade
adriananasc1 eu tbm nao conseguia ai a dipirona baixou minha febre e parou a dor de cabeça estou muito melhor que ontem e se hidrata tbm .	dipirona	febre
adriananasc1 eu tbm nao conseguia ai a dipirona baixou minha febre e parou a dor de cabeça estou muito melhor que ontem e se hidrata tbm .	dipirona	dor de cabeça
ahahahahaha eu fiz o mesmo tweet sábado miga não dá pra morrer mas é quase morte meloxicam funciona .	meloxicam	morte
testosterona contra cansaço fraqueza falta libido dores alzheimer andropausa http youtu be rxmjnrpewh0 a via youtube .	testosterona	cansaço
testosterona contra cansaço fraqueza falta libido dores alzheimer andropausa http youtu be rxmjnrpewh0 a via youtube .	testosterona	fraqueza
alergia a paracetamol que beleza .	paracetamol	alergia
eu tomo omeprazol hoje mesmo fui pro hospital pq tava morrendo de dor .	pro	dor
eu tomo omeprazol hoje mesmo fui pro hospital pq tava morrendo de dor .	omeprazol	dor
