Sentença	 Span_1 	 Span_2 
já sofro de insônia curar enxaqueca com cafeína é dose são 4 07 e eu só tô tentando pregar o olho sem sucesso pelo visto .	cafeína	enxaqueca
já sofro de insônia curar enxaqueca com cafeína é dose são 4 07 e eu só tô tentando pregar o olho sem sucesso pelo visto .	cafeína	insônia
nimesulida é um lixo né tu quer curar a dor de tal coisa e surge outra por causa do remédio .	nimesulida	dor
operacaobetalab cientistas criam pulseira para diabéticos que mede glicose no sangue via suor http bit ly 1xuen7a sdv rt.	glicose	suor
minha glicose fica abaixando com esse calor e eu fico passando mal toda hr .	glicose	calor
opinionmarciana ay pero no hay que leer los folletos de los medicamentos hasta la loratadina puede causar hemorragia y muerte según eso .	loratadina	hemorragia
eu to com dor no estômago do cão e não acho o omeprazol nem fodendo .	omeprazol	dor
eu to viciada em cafeína e morro de dor de cabeça enquanto não tomo café vsf .	cafeína	dor de cabeça
que lembrança mais linda final zinco de gestação a ansiedade tava a mil rsrs http fb me 1ljm0pdhm .	zinco	ansiedade
tanto remédio que eu poderia ter alergia mais vou ter logo de paracetamol que é específico pra dor e ta na maioria de outros .	paracetamol	alergia
tanto remédio que eu poderia ter alergia mais vou ter logo de paracetamol que é específico pra dor e ta na maioria de outros .	paracetamol	dor
agradeço ao topiramato pela náusea que me deu hoje motivo de encher o cu de plasil depois do almoço e ficar dopada o resto do dia .	topiramato	náusea
agradeço ao topiramato pela náusea que me deu hoje motivo de encher o cu de plasil depois do almoço e ficar dopada o resto do dia .	plasil	náusea
levei penicilina para atacar o vírus estou a levar novamente medicação para febre .	penicilina	febre
hj é um péssimo dia p qm tem alergia e ta sem loratadina .	loratadina	alergia
não curto muito chocolate amargo mas é o único que tem em casa e a minha ansiedade tá precisando ingerir glicose .	glicose	ansiedade
a maçã é um dos alimentos mais importantes para combater a ansiedade sendo rica em zinco magnésio e vitaminas http fb me 1u36wsxcq .	vitaminas	ansiedade
a maçã é um dos alimentos mais importantes para combater a ansiedade sendo rica em zinco magnésio e vitaminas http fb me 1u36wsxcq .	zinco	ansiedade
suor frio nas mãos e pés gastrite coração acelerado da lhe omeprazol vomitos matinais só de imaginar levantar e sair de casa .	omeprazol	vomitos
suor frio nas mãos e pés gastrite coração acelerado da lhe omeprazol vomitos matinais só de imaginar levantar e sair de casa .	omeprazol	suor frio
suor frio nas mãos e pés gastrite coração acelerado da lhe omeprazol vomitos matinais só de imaginar levantar e sair de casa .	omeprazol	gastrite
toma nimesulida que passa em 2h pelo menos 50 da dor .	nimesulida	dor
ufa achei que n ia poder viajar pq n tenho a vacina da febre amarela e não posso tomar mas já achei aqui termos q dão isenção .	vacina	febre
acho que tenho alergia a ibuprofeno meus olhos estão super inchados .	ibuprofeno	alergia
meu colesterol e glicose estão perfeitos isso me deixa triste tô longe da morte .	glicose	morte
você tá certo e se for compulsão fluoxetina não é a primeira escolha se fosse ansiedade talvez .	fluoxetina	ansiedade
ai gente vou parar de tomar carbamazepina porque me deu dor no peito ai to cansada de tomar remédios http fb me 3alxf0cef .	carbamazepina	dor no peito
yuktopus sistema nervoso pra dor na garganta qlq analgésico ajuda ou até msm anti inflamatório nimesulida e gargarejo com água morna .	anti	dor
yuktopus sistema nervoso pra dor na garganta qlq analgésico ajuda ou até msm anti inflamatório nimesulida e gargarejo com água morna .	nimesulida	dor
cafeína e ansiedade misturinha nota 10 pra manter um ser humano que só quer dormir hiper acordado .	cafeína	ansiedade
ao você pede um remédio mais forte que nimesulida pra dor de dente e o farmacêutico dar uma mais fraco .	nimesulida	dor de dente
descobri que tenho alergia a penicilina e a derivados .	penicilina	alergia
tomei duas cápsulas de lipo 6 depois tomei um remédio para alergia prednisona e depois tomei um anti inflamatório para a garganta .	prednisona	alergia
tomei duas cápsulas de lipo 6 depois tomei um remédio para alergia prednisona e depois tomei um anti inflamatório para a garganta .	anti	alergia
morreniiiii de cólica prostaglandinas ômega 6 lipídios diminuição do nível de progesterona descamação do endométrio life sucks .	progesterona	descamação
nunca faça vitamina diarreia kkkk http fb me 147hoavsm .	vitamina	diarreia
tenho q fazer algms exames sábado acho q minha glicose tá alta to sentindo tontura de vez em quando .	glicose	tontura
sei que tem a naratriptana pra enxaqueca pra enxaqueca mas o único antidepressivo que lembro com o nome parecido é .	naratriptana	enxaqueca
sei que tem a naratriptana pra enxaqueca pra enxaqueca mas o único antidepressivo que lembro com o nome parecido é .	naratriptana	enxaqueca
eu ia tomar vacina agora mas graças ao calor e a deus eu não irei .	vacina	calor
dor no estomago e dor na garganta pantoprazol ou cefalexina ou os dois que será o equivalente á morte súbita .	pantoprazol	dor
dor no estomago e dor na garganta pantoprazol ou cefalexina ou os dois que será o equivalente á morte súbita .	pantoprazol	dor
dor no estomago e dor na garganta pantoprazol ou cefalexina ou os dois que será o equivalente á morte súbita .	pantoprazol	morte súbita
dor no estomago e dor na garganta pantoprazol ou cefalexina ou os dois que será o equivalente á morte súbita .	cefalexina	dor
dor no estomago e dor na garganta pantoprazol ou cefalexina ou os dois que será o equivalente á morte súbita .	cefalexina	dor
dor no estomago e dor na garganta pantoprazol ou cefalexina ou os dois que será o equivalente á morte súbita .	cefalexina	morte súbita
vou toma omeprazol que dor de estomago lascada .	omeprazol	dor
a capacidade do ser humano em querer passar dor é ótima né me diz como q eu esqueço a porra do omeprazol .	omeprazol	dor
nova febre nas academias suplemento que aumenta a testosterona e o hgh http fb me 7rtcaewpv .	testosterona	febre
o remedio foi receitado pra minha mae a gente nao tem o mesmo tipo de enxaqueca nao somos a mesna pessoa eu preciso ir no neuro pra ver isso .	mesna	enxaqueca
eu nunca tomo dipirona por ter tido alergia a mil anos atrás e mesmo assim minha mãe não me deixa usar nem morrendo .	dipirona	alergia
omeprazol e tandrilax tamojunto vaivêno as dor .	tandrilax	dor
omeprazol e tandrilax tamojunto vaivêno as dor .	omeprazol	dor
bela dependência e uma excelente vacina diga se de passagem pic twitter com abmgtzuixy .	vacina	dependência
com uma dor no braço que tomei glicose domingo .	glicose	dor no braço
e agora josé zica ou vacina confusão da zorra http fb me 525zmbkuv .	vacina	confusão
vou tomar uma cartela de ibuprofeno pra dor que to sentindo .	ibuprofeno	dor
cahpymentha toma cloridrato de naratriptana naramig é para enxaqueca .	naratriptana	enxaqueca
cahpymentha toma cloridrato de naratriptana naramig é para enxaqueca .	cloridrato	enxaqueca
cahpymentha toma cloridrato de naratriptana naramig é para enxaqueca .	naramig	enxaqueca
a cafeína e a linha tênue entre não surtir efeito mas burlar o psicológico te mantendo acordado com tremedeira e alucinação mas acordado .	cafeína	alucinação
sentindo aquela cólica maravilhosa que parece que nem se eu injetar morfina na feia passa a dor .	morfina	dor
calor eu durmo menos como menos tomo mais paracetamol fico mais mal humorado .	paracetamol	calor
cai nos três últimos degraus numa escada caracol de ferro é uma dor q não para .	ferro	dor
tomei uma dipirona pra cefaléia e acabei caindo no sono .	dipirona	sono
eu acordei com tanta dor que eu só queria um omeprazol .	omeprazol	dor
dê adeus ao inchaço e controle a glicose com esta simples receita resultados rápidos http comosefaz eu de adeus ao inchaco e controle a glicose com esta simples receita resultados rapidos .	glicose	inchaço
dê adeus ao inchaço e controle a glicose com esta simples receita resultados rápidos http comosefaz eu de adeus ao inchaco e controle a glicose com esta simples receita resultados rapidos .	glicose	inchaço
eu ainda não sei pq q tomo loratadina essa merda n tira nada da minha alergia .	loratadina	alergia
não to sabendo lidar cm esse calor ainda tomei dipirona to suando igual uma mula .	dipirona	suando
não to sabendo lidar cm esse calor ainda tomei dipirona to suando igual uma mula .	dipirona	calor
carooline rosa compra nimesulida antiflamatório mt bom passa dor em 10 minutos ou menos .	nimesulida	dor
deus me faz ser sócia da fábrica do bupropiona para acalmar essa ansiedade absurda .	bupropiona	ansiedade
eu sou tão genial que qse arranco a ureia n tem palavras p descrever a dor que eu to sentindo kk .	ureia	dor
fica a lição de nunca comer tanto açúcar quando você tem glicose alta você pode dormir e acordar sentindo enxaqueca .	glicose	enxaqueca
que dia complicado a sertralina não segurou hoje nem ontem na noite a depressão veio com força .	sertralina	depressão
to com uma dor de cabeça e não tem se quer um paracetamol .	paracetamol	dor de cabeça
eu tomava sertralina pra ansiedade mas tava me dando reação .	sertralina	ansiedade
papai a minha médica autorizou o uso de cigarro eletrônico menta sem nicotina para driblar minha ansiedade .	nicotina	ansiedade
não desejo alergia a dipirona nem ao meu pior inimigo .	dipirona	alergia
cafeína e nicotina as vezes é o melhor remédio p ansiedade .	cafeína	ansiedade
cafeína e nicotina as vezes é o melhor remédio p ansiedade .	nicotina	ansiedade
tomo glicose até não querer mais e medicamento pra dor na veia rapidinho melhoraaaaaa .	glicose	dor
uma excelente opção para amenizar o calor é o baer mate um mate gaseificado com cafeína é ainda mais delicioso http fb me 6wdivk4kh .	cafeína	calor
eu tenho alergia a algum composto da loratadina açlskdçalskd https twitter com whoisstark status 777696318634528768 .	loratadina	alergia
uhum já entrei em coma alcoólico e tomei glicose pra acordar .	glicose	coma
dor no estômago não a omeprazol que resolva .	omeprazol	dor
eu to com muita dor daria a vida por um omeprazol .	omeprazol	dor
tenho uma lista de exercícios de físico química pra resolver entre hoje e amanhã e essa dor na mão só mais tramadol pra ajudar .	tramadol	dor
hoje foi dia de vacina aproveitamos e pesamos o santi caso de febre e tenha que medicar aos 3 meses pesando http fb me 10urhnpll .	vacina	febre
as oleaginosas contêm gorduras saudáveis e nutrientes como o zinco selénio e vitamina e que ajudam a evitar a ansiedade e depressão .	vitamina e	depressão
as oleaginosas contêm gorduras saudáveis e nutrientes como o zinco selénio e vitamina e que ajudam a evitar a ansiedade e depressão .	vitamina e	ansiedade
as oleaginosas contêm gorduras saudáveis e nutrientes como o zinco selénio e vitamina e que ajudam a evitar a ansiedade e depressão .	zinco	depressão
as oleaginosas contêm gorduras saudáveis e nutrientes como o zinco selénio e vitamina e que ajudam a evitar a ansiedade e depressão .	zinco	ansiedade
mkarolqueiroz tomo lexotan para ansiedade para a agonia das pernas tomo clonazepan paroxetina meu é manipulado e funciona cmg bastante .	lexotan	ansiedade
mkarolqueiroz tomo lexotan para ansiedade para a agonia das pernas tomo clonazepan paroxetina meu é manipulado e funciona cmg bastante .	paroxetina	ansiedade
retiro o que eu disse sobre meu amor pelo naproxeno sódico pois minha dor nas costas voltou n caiam nessa .	naproxeno	dor nas costas
sekishike depressão e ansiedade e o escitalopram me deixa mais ansiosa ainda .	escitalopram	ansiedade
sekishike depressão e ansiedade e o escitalopram me deixa mais ansiosa ainda .	escitalopram	depressão
meu remédio pra ansiedade eu chamo de omeprazol pq neh gastrite nervosa eh assim gente .	omeprazol	gastrite
meu remédio pra ansiedade eu chamo de omeprazol pq neh gastrite nervosa eh assim gente .	omeprazol	ansiedade
não tô ressecada mas vinho dá uma dorzinha de cabeça marota heim já detonei uma caixa de bis pra repor a glicose e a dor de cabeça lá .	glicose	dor de cabeça
ndradems relativebrain gabrielfforsi eu tenho alergia a uma cacetada de aine descobri com o uso de nimesulida por 03 dias .	nimesulida	alergia
toma nimesulida tava cm dor de dente essa semana tbm e só isso resolveu .	nimesulida	dor de dente
acordei tô indo comer um pastel na feira mas esqueci do omeprazol azia é certo .	omeprazol	azia
que merda ter q sair de casa nessa chuva só p tomar vacina da alergia .	vacina	alergia
vou ter que ir na minha vó hoje recorrer à uns omeprazol essa azia diária tá me matando .	omeprazol	azia
bicarbonato de sódio me salvando da azia 3 .	bicarbonato de sódio	azia
graças a deus tenho alergia a essa vacina imagina sentir a dor de dar o cu deus me livre so micaelly mesmo pra isso https twitter com houislittlepill status 763116639072161792 .	vacina	alergia
graças a deus tenho alergia a essa vacina imagina sentir a dor de dar o cu deus me livre so micaelly mesmo pra isso https twitter com houislittlepill status 763116639072161792 .	vacina	dor
jaurelaurens hm tô tomando naproxeno sódico a dor já passou mas minha bochecha ainda tá inchada vc sabe quanto tempo leva pra desinchar .	naproxeno	dor
nossa amiga muito obrigada já passei na farmácia e comprei nimesulida pra desinflamar e dorflex pra dor no geral .	nimesulida	dor
nossa amiga muito obrigada já passei na farmácia e comprei nimesulida pra desinflamar e dorflex pra dor no geral .	dorflex	dor
a dermatologista disse que eu posso usar pq minha acne e grau 3 mas achei melhor usar tetraciclina antes vc ja usou .	tetraciclina	acne
de um lado só pode ser enxaqueca toma um paracetamol e acredite cafeína hoje me salvei de uma crise assim .	paracetamol	enxaqueca
de um lado só pode ser enxaqueca toma um paracetamol e acredite cafeína hoje me salvei de uma crise assim .	cafeína	enxaqueca
dormindo cm óleo de ricino e óleo de coco na cabeça amanhã cedo já vai dar pra fritar um ovo já cm calor e todo esses óleos na cabeça .	óleo	calor
dormindo cm óleo de ricino e óleo de coco na cabeça amanhã cedo já vai dar pra fritar um ovo já cm calor e todo esses óleos na cabeça .	óleo	calor
imagina o cheiro de testosterona que não deve ser esse pano de chão de suor .	testosterona	suor
pior do que passar calor dentro do transporte público é uma pessoa com cheiro insuportável de nicotina sentar do seu lado a viagem toda .	nicotina	calor
to tomando nimesulida e dipirona pra dor valeu qualquer coisa eu falo contigo sim .	dipirona	dor
to tomando nimesulida e dipirona pra dor valeu qualquer coisa eu falo contigo sim .	nimesulida	dor
morrer de dor de estômago ou ir comprar ranitidina a pé eis a questão .	ranitidina	dor
topiramato estava segurando bem a minha dor de cabeça mas ontem tive por causa do maldito antipsicótico vou parar de tomar essa desgraça .	topiramato	dor de cabeça
ain não fica tomando dipirona toda hora não eu tomo quando tô com dor de cabeça não é m m não deixa eu tomar minha dipirona em pazzzz .	dipirona	dor de cabeça
ain não fica tomando dipirona toda hora não eu tomo quando tô com dor de cabeça não é m m não deixa eu tomar minha dipirona em pazzzz .	dipirona	dor de cabeça
me dá um comprimido pra dor um comprimido é muito então me vê metadona .	metadona	dor
toma amoxicilina de 8 em 8 horas e prednisona a cada 24 horas comigo sempre passa a dor e com quem eu conheço sempre dá certo tbm .	prednisona	dor
toma amoxicilina de 8 em 8 horas e prednisona a cada 24 horas comigo sempre passa a dor e com quem eu conheço sempre dá certo tbm .	amoxicilina	dor
omeprazol é um lixo vou ter que aguentar a dor até passar .	omeprazol	dor
tomei café e estranhamente minha dor de cabeça passou de novo acho que realmente sou viciada em cafeína .	cafeína	dor de cabeça
adivinha quem tem alergia a dipirona e tomou uma seringa inteira ontem euzinha e agora tô toda inchada pq não sabia .	dipirona	alergia
prefsp haddad fernando saudeprefsp showdavida de alta dependência pelos pacientes mamãe faz uso de sertralina e há 3 dias sofre afalta .	sertralina	dependência
mas quando o nene fica doente procura uma farmácia de plantão o farmacêutico passa tylenol o nene tem alergia dipirona tem só adulto é azed .	dipirona	alergia
mas quando o nene fica doente procura uma farmácia de plantão o farmacêutico passa tylenol o nene tem alergia dipirona tem só adulto é azed .	tylenol	alergia
mas quando o nene fica doente procura uma farmácia de plantão o farmacêutico passa tylenol o nene tem alergia dipirona tem só adulto é azed .	nene	alergia
mas quando o nene fica doente procura uma farmácia de plantão o farmacêutico passa tylenol o nene tem alergia dipirona tem só adulto é azed .	nene	alergia
morta de febre dor sem tomar paracetamol morta de coriza calor espirro depois do paracetamol .	paracetamol	febre
morta de febre dor sem tomar paracetamol morta de coriza calor espirro depois do paracetamol .	paracetamol	dor
morta de febre dor sem tomar paracetamol morta de coriza calor espirro depois do paracetamol .	paracetamol	calor
morta de febre dor sem tomar paracetamol morta de coriza calor espirro depois do paracetamol .	paracetamol	febre
morta de febre dor sem tomar paracetamol morta de coriza calor espirro depois do paracetamol .	paracetamol	dor
morta de febre dor sem tomar paracetamol morta de coriza calor espirro depois do paracetamol .	paracetamol	calor
hoje vou toma paracetamol que nem louca pra ver se passa essa dor .	paracetamol	dor
tomar azitromicina é o msm que dar um tiro no estômago pqp q dor do crlh .	azitromicina	dor
tem um remédio que chama enxak é o melhor que tem além de ter cafeína ainda relaxa da uma sensação de drog mara e a dor passa kk .	cafeína	dor
descobri só hoje que a dorzinha pós exame e injeção soro glicose remédio p náusea não era a toa tem coisa errada comigo .	glicose	náusea
descobri só hoje que a dorzinha pós exame e injeção soro glicose remédio p náusea não era a toa tem coisa errada comigo .	soro	náusea
isso pode resultar em uma baixa da taxa de glicose no sangue ocasionando sonolência falta de concentração e dor de cabeça .	glicose	dor de cabeça
isso pode resultar em uma baixa da taxa de glicose no sangue ocasionando sonolência falta de concentração e dor de cabeça .	glicose	sonolência
clonazepam eh em dose menor pra crise de panico e ansiedade antes eu tomava o de 2 mg pra dormi mas troquei por quetiapina .	quetiapina	ansiedade
clonazepam eh em dose menor pra crise de panico e ansiedade antes eu tomava o de 2 mg pra dormi mas troquei por quetiapina .	clonazepam	ansiedade
cafeína é uma luta entre felicidade e dor de cabeça .	cafeína	dor de cabeça
vou tomar uma cartela de nimesulida e esperar a morte chegar ouvindo pillowtalk .	nimesulida	morte
folha vai fazer uma escolinha de controle de raiva tomar diazepan 3 x ao dia e aldol com quetiapina .	quetiapina	raiva
e agora o twitter me fez descobrir que o edu testosterona ainda existe que morte horrível .	testosterona	morte
você nem sonha mas às vezes eu tenho vontade de te encher de ibuprofeno pra você morrer de alergia .	ibuprofeno	alergia
eu ainda tô na onda da cafeína ou tá mt calor .	cafeína	calor
minha glicose esta me dando raiva ja porra toda hora fico tonta .	glicose	raiva
não devia ter tomado nimesulida tá me dando enjôo e tontura .	nimesulida	enjôo
não devia ter tomado nimesulida tá me dando enjôo e tontura .	nimesulida	tontura
pqp no aniversario de uma pessoa e a pessoa so fala de si mesna merda e fala mais merda manja aquela diarreia latino .	mesna	diarreia
quando a vida te der limões vc mistura com água e bicarbonato de sódio e bebe pra aliviar a azia de existir .	bicarbonato de sódio	azia
vanfranquilino eu tb me ferrei meu diagnóstico de depressão veio pós sibutramina .	sibutramina	depressão
bouxian eu to tentando descobrir alguma coisa pra fazer porque dopamina é a melhor droga que eu posso ter pra melhorar a ansiedade .	dopamina	ansiedade
falta de cafeína so me dá dor de cabeça .	cafeína	dor de cabeça
diminui a dose do fluoxetina pq tava me dando enjoo mas parece q a dose menor n tá fzd efeito oq eu faço morro de enjoo ou de ansiedade .	fluoxetina	ansiedade
diminui a dose do fluoxetina pq tava me dando enjoo mas parece q a dose menor n tá fzd efeito oq eu faço morro de enjoo ou de ansiedade .	fluoxetina	enjoo
diminui a dose do fluoxetina pq tava me dando enjoo mas parece q a dose menor n tá fzd efeito oq eu faço morro de enjoo ou de ansiedade .	fluoxetina	enjoo
dopamina em excesso causa depressão .	dopamina	depressão
eu tomei 2 paracetamol de 750 e a dor de cabeça não passou .	paracetamol	dor de cabeça
pedi pra minha mae me dar novalgina liquida pra ver se a dor passa a que ponto cheguei .	novalgina	dor
se for dor de garganta amoxilina mas so indo no medico infecçao urinaria ampicilina mas so indo no medico eu tomei mas eu ne .	ampicilina	dor de garganta
tenho alergia a glicerina que maravilha .	glicerina	alergia
o meu pai apostou em dengue a minha mãe em infecção alimentar por minha alergia a mil comidas e minha irmã em alergia a penicilina .	penicilina	alergia
o meu pai apostou em dengue a minha mãe em infecção alimentar por minha alergia a mil comidas e minha irmã em alergia a penicilina .	penicilina	infecção
o meu pai apostou em dengue a minha mãe em infecção alimentar por minha alergia a mil comidas e minha irmã em alergia a penicilina .	penicilina	alergia
parecetamol p dor de cabeça cefalexina pra garganta bombinha pra tosse mais alguma coisa .	cefalexina	tosse
parecetamol p dor de cabeça cefalexina pra garganta bombinha pra tosse mais alguma coisa .	cefalexina	dor de cabeça
bom dia pra quem acorda morrendo de dor de estômago e tem que tomar omeprazol as 05 56 da manha .	omeprazol	dor
mas foi loko que a febre abaixou algumas horas depois que eu tomei o ibuprofeno no dia e não subiu mais .	ibuprofeno	febre
tomei 2 fluoxetina hj será que faz efeito e tira essa ansiedade sei lá o que que não deixa eu relaxar a mente pra dormir .	fluoxetina	ansiedade
um desespero chamado to loca de dor de garganta e não tem nimesulida .	nimesulida	dor de garganta
eu tenho alergia à alguns remédios dipirona sódica ácido acetilsalicílico e doses altas de paracetamol .	ácido acetilsalicílico	alergia
eu tenho alergia à alguns remédios dipirona sódica ácido acetilsalicílico e doses altas de paracetamol .	dipirona	alergia
eu tenho alergia à alguns remédios dipirona sódica ácido acetilsalicílico e doses altas de paracetamol .	paracetamol	alergia
alias vcs podiam me aplicar propofol que é a única coisa que pode fazer essa dor parar .	propofol	dor
há evidências que calcio habitualmente utilizado com ou sem vit d não se relaciona com doença cardiovascular http annals org aim article 2571714 lack evidence linking calcium without vitamin d supplementation cardiovascular disease wbckq2gc9fu twitter .	calcium	doença cardiovascular
cadê minha morfina pra amenizar essa dor que é não poder te ter do meu lado .	morfina	dor
dor de cabeça tomou conta e minha glicose abalada .	glicose	dor de cabeça
oi gente sou eu a xu aff q dor de garganta vamos tomar bastante nimesulida .	nimesulida	dor de garganta
cara quando é que eu vou aprender eu não posso comer fritura comi e agora estou aqui precisando de um omeprazol que dor .	omeprazol	dor
finalmente a médica me deu alta da vacina de alergia graças a deus .	vacina	alergia
mas que depressão vai uma cafeína .	cafeína	depressão
todo dia era dor de cabeça dor de estômago dor de cabeça por causa do estômago omeprazol de manhã e de noite sem dar conta nariz sangrava .	omeprazol	dor de cabeça
todo dia era dor de cabeça dor de estômago dor de cabeça por causa do estômago omeprazol de manhã e de noite sem dar conta nariz sangrava .	omeprazol	dor de cabeça
todo dia era dor de cabeça dor de estômago dor de cabeça por causa do estômago omeprazol de manhã e de noite sem dar conta nariz sangrava .	omeprazol	dor
ela tava doente o comprimido entro na mente dipirona desceu quente dor de cabeça bb .	dipirona	dor de cabeça
ja tomei dois comprimidos de nimesulida e essa dor não passa .	nimesulida	dor
eu quero muito adotar um cachorro que vi aí descubro que ele tem problema de ansiedade toma fluoxetina todo dia e tem toc como não amar .	fluoxetina	ansiedade
01 sentimento tristeza de ter desenvolvido alergia a paracetamol e não poder fazer coquetel de remédio pra gripe já estaria ótima .	paracetamol	alergia
01 sentimento tristeza de ter desenvolvido alergia a paracetamol e não poder fazer coquetel de remédio pra gripe já estaria ótima .	paracetamol	gripe
mais 15 min ouvindo isso e eu vou precisar tomar fluoxetina para a depressão .	fluoxetina	depressão
por que querem dar dipirona pra minha vó se ela não tá nem com dor nem com febre não vão dar nada até alergia a esse remédio ela tem .	dipirona	febre
por que querem dar dipirona pra minha vó se ela não tá nem com dor nem com febre não vão dar nada até alergia a esse remédio ela tem .	dipirona	alergia
por que querem dar dipirona pra minha vó se ela não tá nem com dor nem com febre não vão dar nada até alergia a esse remédio ela tem .	dipirona	dor
eu tinha que ir no posto tomar vacina mas com esse calor desanima até de estar viva .	vacina	calor
não tem coisa pior do que esse gosto de morte que fica depois de tomar secnidazol .	secnidazol	morte
hoje passar na anvisa pra pegar a carteirinha internacional de vacina da febre amarela .	vacina	febre
